Fight,OUTCOME
Jamie Varner  vs. Gleison Tibau ,L/W
Louis Gaudinot  vs. Tim Elliott ,L/W
Pascal Krauss  vs. Hyun Gyu Lim ,L/W
Chico Camus  vs. Kyung Ho Kang ,W/L
Soa Palelei  vs. Nikita Krylov ,W/L
Ryan Couture  vs. Al Iaquinta ,L/W
Jared Hamman  vs. Magnus Cedenblad ,L/W
Carlos Condit  vs. Martin Kampmann ,W/L
Donald Cerrone  vs. Rafael Dos Anjos ,L/W
Kelvin Gastelum  vs. Brian Melancon ,W/L
Court McGee  vs. Robert Whittaker ,W/L
Takeya Mizugaki  vs. Erik Perez ,W/L
Brad Tavares  vs. Robert McDaniel ,W/L
Dylan Andrews  vs. Papy Abedi ,W/L
Justin Edwards  vs. Brandon Thatch ,L/W
Darren Elkins  vs. Hatsu Hioki ,W/L
James Head  vs. Jason High ,L/W
Zak Cummings  vs. Ben Alloway ,W/L
Roger Bowling  vs. Abel Trujillo ,NC/NC
Mauricio Rua  vs. Chael Sonnen ,L/W
Alistair Overeem  vs. Travis Browne ,L/W
Urijah Faber  vs. Iuri Alcantara ,W/L
Matt Brown  vs. Mike Pyle ,W/L
Uriah Hall  vs. John Howard ,L/W
Joe Lauzon  vs. Michael Johnson ,L/W
Brad Pickett  vs. Michael McDonald ,L/W
Conor McGregor  vs. Max Holloway ,W/L
Mike Brown  vs. Steven Siler ,L/W
Diego Brandao  vs. Daniel Pineda ,W/L
Manvel Gamburyan  vs. Cole Miller ,W/L
Cody Donovan  vs. Ovince Saint Preux ,L/W
Ramsey Nijem  vs. James Vick ,L/W
Jose Aldo  vs. Chan Sung Jung ,W/L
Lyoto Machida  vs. Phil Davis ,L/W
Cezar Ferreira  vs. Thiago Santos ,W/L
Thales Leites  vs. Tom Watson ,W/L
John Lineker  vs. Jose Maria ,W/L
Vinny Magalhaes  vs. Anthony Perosh ,L/W
Amanda Nunes  vs. Sheila Gaff ,W/L
Sergio Moraes  vs. Neil Magny ,W/L
Ian McCall  vs. Iliarde Santos ,W/L
Rani Yahya  vs. Josh Clopton ,W/L
Ednaldo Oliveira  vs. Francimar Barroso ,L/W
Viscardi Andrade  vs. Bristol Marunde ,W/L
Demetrious Johnson  vs. John Moraga ,W/L
Rory MacDonald  vs. Jake Ellenberger ,W/L
Robbie Lawler  vs. Bobby Voelker ,W/L
Liz Carmouche  vs. Jessica Andrade ,W/L
Michael Chiesa  vs. Jorge Masvidal ,L/W
Danny Castillo  vs. Tim Means ,W/L
Mac Danzig  vs. Melvin Guillard ,L/W
Yves Edwards  vs. Daron Cruickshank ,L/W
Ed Herman  vs. Trevor Smith ,W/L
Julie Kedzie  vs. Germaine de Randamie ,L/W
Aaron Riley  vs. Justin Salas ,L/W
John Albert  vs. Yaotzin Meza ,L/W
Anderson Silva  vs. Chris Weidman ,L/W
Frankie Edgar  vs. Charles Oliveira ,W/L
Tim Kennedy  vs. Roger Gracie ,W/L
Mark Munoz  vs. Tim Boetsch ,W/L
Cub Swanson  vs. Dennis Siver ,W/L
Chris Leben  vs. Andrew Craig ,L/W
Norman Parke  vs. Kazuki Tokudome ,W/L
Gabriel Gonzaga  vs. Dave Herman ,W/L
Edson Barboza  vs. Rafaello Oliveira ,W/L
Seth Baczynski  vs. Brian Melancon ,L/W
Mike Pierce  vs. David Mitchell ,W/L
Rashad Evans  vs. Dan Henderson ,W/L
Roy Nelson  vs. Stipe Miocic ,L/W
Ryan Jimmo  vs. Igor Pokrajac ,W/L
Alexis Davis  vs. Rosi Sexton ,W/L
Pat Barry  vs. Shawn Jordan ,L/W
Jake Shields  vs. Tyron Woodley ,W/L
Sam Stout  vs. James Krause ,L/W
Sean Pierson  vs. Kenny Robertson ,W/L
Roland Delorme  vs. Edwin Figueroa ,W/L
Mitch Clarke  vs. John Maguire ,W/L
Yves Jabouin  vs. Dustin Pague ,W/L
Antonio Rodrigo Nogueira  vs. Fabricio Werdum ,L/W
William Macario  vs. Leonardo Santos ,L/W
Thiago Silva  vs. Rafael Cavalcante ,W/L
Erick Silva  vs. Jason High ,W/L
Daniel Sarafian  vs. Eddie Mendez ,W/L
Rony Jason  vs. Mike Wilkinson ,W/L
Raphael Assuncao  vs. Vaughan Lee ,W/L
Godofredo Pepey  vs. Felipe Arantes ,L/W
Ildemar Alcantara  vs. Leandro Silva ,W/L
Rodrigo Damm  vs. Mizuto Hirota ,W/L
Caio Magalhaes  vs. Karlos Vemola ,W/L
Antonio Braga Neto  vs. Anthony Smith ,W/L
Cain Velasquez  vs. Antonio Silva ,W/L
Junior Dos Santos  vs. Mark Hunt ,W/L
Glover Teixeira  vs. James Te Huna ,W/L
Gray Maynard  vs. TJ Grant ,L/W
Donald Cerrone  vs. KJ Noons ,W/L
Mike Pyle  vs. Rick Story ,W/L
Dennis Bermudez  vs. Max Holloway ,W/L
Colton Smith  vs. Robert Whittaker ,L/W
Khabib Nurmagomedov  vs. Abel Trujillo ,W/L
Stephen Thompson  vs. Nah-Shon Burrell ,W/L
Brian Bowles  vs. George Roop ,L/W
Jeremy Stephens  vs. Estevan Payan ,W/L
Vitor Belfort  vs. Luke Rockhold ,W/L
Jacare Souza  vs. Chris Camozzi ,W/L
Rafael Dos Anjos  vs. Evan Dunham ,W/L
Rafael Natal  vs. Joao Zeferino ,W/L
Hacran Dias  vs. Nik Lentz ,L/W
Francisco Trinaldo  vs. Mike Rio ,W/L
Gleison Tibau  vs. John Cholish ,W/L
Paulo Thiago  vs. Michel Prazeres ,W/L
Iuri Alcantara  vs. Iliarde Santos ,W/L
Fabio Maldonado  vs. Roger Hollett ,W/L
John Lineker  vs. Azamat Gashimov ,W/L
Jussier Formiga  vs. Chris Cariaso ,W/L
Lucas Martins  vs. Jeremy Larsen ,W/L
Jon Jones  vs. Chael Sonnen ,W/L
Michael Bisping  vs. Alan Belcher ,W/L
Roy Nelson  vs. Cheick Kongo ,W/L
Phil Davis  vs. Vinny Magalhaes ,W/L
Jim Miller  vs. Pat Healy ,NC/NC
Rustam Khabilov  vs. Yancy Medeiros ,W/L
Gian Villante  vs. Ovince Saint Preux ,L/W
Sara McMann  vs. Sheila Gaff ,W/L
Bryan Caraway  vs. Johnny Bedford ,W/L
Leonard Garcia  vs. Cody McKenzie ,L/W
Steven Siler  vs. Kurt Holobaugh ,W/L
Benson Henderson  vs. Gilbert Melendez ,W/L
Frank Mir  vs. Daniel Cormier ,L/W
Nate Diaz  vs. Josh Thomson ,L/W
Matt Brown  vs. Jordan Mein ,W/L
Chad Mendes  vs. Darren Elkins ,W/L
Francis Carmont  vs. Lorenz Larkin ,W/L
Ramsey Nijem  vs. Myles Jury ,L/W
Joseph Benavidez  vs. Darren Uyenoyama ,W/L
Tim Means  vs. Jorge Masvidal ,L/W
TJ Dillashaw  vs. Hugo Viana ,W/L
Anthony Njokuani  vs. Roger Bowling ,W/L
Clifford Starks  vs. Yoel Romero ,L/W
Urijah Faber  vs. Scott Jorgensen ,W/L
Uriah Hall  vs. Kelvin Gastelum ,L/W
Miesha Tate  vs. Cat Zingano ,L/W
Travis Browne  vs. Gabriel Gonzaga ,W/L
Robert McDaniel  vs. Gilbert Smith ,W/L
Josh Samman  vs. Kevin Casey ,W/L
Luke Barnatt  vs. Collin Hart ,W/L
Dylan Andrews  vs. Jimmy Quinlan ,W/L
Bristol Marunde  vs. Clint Hester ,L/W
Cole Miller  vs. Bart Palaszewski ,W/L
Sam Sicilia  vs. Maximo Blanco ,L/W
Justin Lawrence  vs. Daniel Pineda ,L/W
Gegard Mousasi  vs. Ilir Latifi ,W/L
Ryan Couture  vs. Ross Pearson ,L/W
Matt Mitrione  vs. Philip De Fries ,W/L
Brad Pickett  vs. Mike Easton ,W/L
Diego Brandao  vs. Pablo Garza ,W/L
Akira Corassani  vs. Robert Peralta ,W/L
Reza Madadi  vs. Michael Johnson ,W/L
Tor Troeng  vs. Adam Cella ,W/L
Chris Spang  vs. Adlan Amagov ,L/W
Marcus Brimage  vs. Conor McGregor ,L/W
Ben Alloway  vs. Ryan LaFlare ,L/W
Michael Kuiper  vs. Tom Lawlor ,L/W
Papy Abedi  vs. Besam Yousef ,W/L
Georges St-Pierre  vs. Nick Diaz ,W/L
Carlos Condit  vs. Johny Hendricks ,L/W
Jake Ellenberger  vs. Nate Marquardt ,W/L
Nick Ring  vs. Chris Camozzi ,L/W
Mike Ricci  vs. Colin Fletcher ,W/L
Patrick Cote  vs. Bobby Voelker ,W/L
Antonio Carvalho  vs. Darren Elkins ,L/W
Dan Miller  vs. Jordan Mein ,L/W
John Makdessi  vs. Daron Cruickshank ,W/L
Rick Story  vs. Quinn Mulhern ,W/L
TJ Dillashaw  vs. Issei Tamura ,W/L
George Roop  vs. Reuben Duran ,W/L
Wanderlei Silva  vs. Brian Stann ,W/L
Stefan Struve  vs. Mark Hunt ,L/W
Takanori Gomi  vs. Diego Sanchez ,L/W
Yushin Okami  vs. Hector Lombard ,W/L
Mizuto Hirota  vs. Rani Yahya ,L/W
Dong Hyun Kim  vs. Siyar Bahadurzada ,W/L
Riki Fukuda  vs. Brad Tavares ,L/W
Takeya Mizugaki  vs. Bryan Caraway ,W/L
Cristiano Marcello  vs. Kazuki Tokudome ,L/W
Alex Caceres  vs. Kyung Ho Kang ,NC/NC
Marcelo Guimaraes  vs. Hyun Gyu Lim ,L/W
Ronda Rousey  vs. Liz Carmouche ,W/L
Lyoto Machida  vs. Dan Henderson ,W/L
Urijah Faber  vs. Ivan Menjivar ,W/L
Court McGee  vs. Josh Neer ,W/L
Josh Koscheck  vs. Robbie Lawler ,L/W
Brendan Schaub  vs. Lavar Johnson ,W/L
Michael Chiesa  vs. Anton Kuivanen ,W/L
Dennis Bermudez  vs. Matt Grice ,W/L
Sam Stout  vs. Caros Fodor ,W/L
Kenny Robertson  vs. Brock Jardine ,W/L
Jon Manley  vs. Neil Magny ,L/W
Nah-Shon Burrell  vs. Yuri Villefort ,W/L
Renan Barao  vs. Michael McDonald ,W/L
Cub Swanson  vs. Dustin Poirier ,W/L
Jimi Manuwa  vs. Cyrille Diabate ,W/L
Gunnar Nelson  vs. Jorge Santiago ,W/L
James Te Huna  vs. Ryan Jimmo ,W/L
Che Mills  vs. Matthew Riddle ,NC/NC
Terry Etim  vs. Renee Forte ,L/W
Paul Sass  vs. Danny Castillo ,L/W
Andy Ogle  vs. Josh Grispi ,W/L
Tom Watson  vs. Stanislav Nedkov ,W/L
Vaughan Lee  vs. Motonobu Tezuka ,W/L
Phil Harris  vs. Ulysses Gomez ,W/L
Jose Aldo  vs. Frankie Edgar ,W/L
Rashad Evans  vs. Rogerio Nogueira ,L/W
Alistair Overeem  vs. Antonio Silva ,L/W
Jon Fitch  vs. Demian Maia ,L/W
Joseph Benavidez  vs. Ian McCall ,W/L
Gleison Tibau  vs. Evan Dunham ,L/W
Tyron Woodley  vs. Jay Hieron ,W/L
Jacob Volkmann  vs. Bobby Green ,L/W
Yves Edwards  vs. Isaac Vallie-Flagg ,L/W
Chico Camus  vs. Dustin Kimura ,L/W
Edwin Figueroa  vs. Francisco Rivera ,L/W
Demetrious Johnson  vs. John Dodson ,W/L
Quinton Jackson  vs. Glover Teixeira ,L/W
Anthony Pettis  vs. Donald Cerrone ,W/L
Erik Koch  vs. Ricardo Lamas ,L/W
TJ Grant  vs. Matt Wiman ,W/L
Clay Guida  vs. Hatsu Hioki ,W/L
Mike Stumpf  vs. Pascal Krauss ,L/W
Ryan Bader  vs. Vladimir Matyushenko ,W/L
Mike Russow  vs. Shawn Jordan ,L/W
Rafael Natal  vs. Sean Spencer ,W/L
Simeon Thoresen  vs. David Mitchell ,L/W
Vitor Belfort  vs. Michael Bisping ,W/L
Daniel Sarafian  vs. CB Dollaway ,L/W
Gabriel Gonzaga  vs. Ben Rothwell ,W/L
Thiago Tavares  vs. Khabib Nurmagomedov ,L/W
Godofredo Pepey  vs. Milton Vieira ,W/L
Ronny Markes  vs. Andrew Craig ,W/L
Diego Nunes  vs. Nik Lentz ,L/W
Edson Barboza  vs. Lucas Martins ,W/L
Iuri Alcantara  vs. Pedro Nobre ,NC/NC
Wagner Prado  vs. Ildemar Alcantara ,L/W
Francisco Trinaldo  vs. CJ Keith ,W/L
Junior Dos Santos  vs. Cain Velasquez ,L/W
Jim Miller  vs. Joe Lauzon ,W/L
Tim Boetsch  vs. Constantinos Philippou ,L/W
Yushin Okami  vs. Alan Belcher ,W/L
Chris Leben  vs. Derek Brunson ,L/W
Brad Pickett  vs. Eddie Wineland ,L/W
Erik Perez  vs. Byron Bloodworth ,W/L
Melvin Guillard  vs. Jamie Varner ,L/W
Michael Johnson  vs. Myles Jury ,L/W
Philip De Fries  vs. Todd Duffee ,L/W
Leonard Garcia  vs. Max Holloway ,L/W
Chris Cariaso  vs. John Moraga ,L/W
Roy Nelson  vs. Matt Mitrione ,W/L
Colton Smith  vs. Mike Ricci ,W/L
Pat Barry  vs. Shane del Rosario ,W/L
Dustin Poirier  vs. Jonathan Brookins ,W/L
Mike Pyle  vs. James Head ,W/L
Johnny Bedford  vs. Marcos Vinicius ,W/L
Vinc Pichel  vs. Rustam Khabilov ,L/W
TJ Waldburger  vs. Nick Catone ,W/L
Reuben Duran  vs. Hugo Viana ,L/W
Mike Rio  vs. John Cofer ,W/L
Jared Papazian  vs. Tim Elliott ,L/W
George Sotiropoulos  vs. Ross Pearson ,L/W
Robert Whittaker  vs. Brad Scott ,W/L
Colin Fletcher  vs. Norman Parke ,L/W
Hector Lombard  vs. Rousimar Palhares ,W/L
Chad Mendes  vs. Yaotzin Meza ,W/L
Igor Pokrajac  vs. Joey Beltran ,NC/NC
Mike Pierce  vs. Seth Baczynski ,W/L
Ben Alloway  vs. Manuel Rodriguez ,W/L
Brendan Loughnane  vs. Mike Wilkinson ,L/W
Nick Penner  vs. Cody Donovan ,L/W
Benson Henderson  vs. Nate Diaz ,W/L
Mauricio Rua  vs. Alexander Gustafsson ,L/W
BJ Penn  vs. Rory MacDonald ,L/W
Mike Swick  vs. Matt Brown ,L/W
Yves Edwards  vs. Jeremy Stephens ,W/L
Raphael Assuncao  vs. Mike Easton ,W/L
Ramsey Nijem  vs. Joe Proctor ,W/L
Daron Cruickshank  vs. Henry Martinez ,W/L
Marcus LeVesseur  vs. Abel Trujillo ,L/W
Dennis Siver  vs. Nam Phan ,W/L
Scott Jorgensen  vs. John Albert ,W/L
Georges St-Pierre  vs. Carlos Condit ,W/L
Johny Hendricks  vs. Martin Kampmann ,W/L
Francis Carmont  vs. Tom Lawlor ,W/L
Mark Bocek  vs. Rafael Dos Anjos ,L/W
Mark Hominick  vs. Pablo Garza ,L/W
Patrick Cote  vs. Alessio Sakara ,W/L
Cyrille Diabate  vs. Chad Griggs ,W/L
Sam Stout  vs. John Makdessi ,L/W
Antonio Carvalho  vs. Rodrigo Damm ,W/L
Matthew Riddle  vs. John Maguire ,W/L
Ivan Menjivar  vs. Azamat Gashimov ,W/L
Steven Siler  vs. Darren Elkins ,L/W
Rich Franklin  vs. Cung Le ,L/W
Thiago Silva  vs. Stanislav Nedkov ,NC/NC
Dong Hyun Kim  vs. Paulo Thiago ,W/L
Takanori Gomi  vs. Mac Danzig ,W/L
Zhang Tiequan  vs. Jon Tuck ,L/W
Takeya Mizugaki  vs. Jeff Hougland ,W/L
Alex Caceres  vs. Motonobu Tezuka ,W/L
Yasuhiro Urushitani  vs. John Lineker ,L/W
Riki Fukuda  vs. Tom DeBlass ,W/L
Anderson Silva  vs. Stephan Bonnar ,W/L
Antonio Rodrigo Nogueira  vs. Dave Herman ,W/L
Glover Teixeira  vs. Fabio Maldonado ,W/L
Jon Fitch  vs. Erick Silva ,W/L
Phil Davis  vs. Wagner Prado ,W/L
Demian Maia  vs. Rick Story ,W/L
Rony Jason  vs. Sam Sicilia ,W/L
Gleison Tibau  vs. Francisco Trinaldo ,W/L
Diego Brandao  vs. Joey Gambino ,W/L
Sergio Moraes  vs. Renee Forte ,W/L
Luiz Cane  vs. Chris Camozzi ,L/W
Cristiano Marcello  vs. Reza Madadi ,W/L
Travis Browne  vs. Antonio Silva ,L/W
Jake Ellenberger  vs. Jay Hieron ,W/L
John Dodson  vs. Jussier Formiga ,W/L
Josh Neer  vs. Justin Edwards ,L/W
Michael Johnson  vs. Danny Castillo ,W/L
Aaron Simpson  vs. Mike Pierce ,L/W
Marcus LeVesseur  vs. Carlo Prater ,W/L
Jacob Volkmann  vs. Shane Roller ,W/L
Bart Palaszewski  vs. Diego Nunes ,L/W
Darren Uyenoyama  vs. Phil Harris ,W/L
Stefan Struve  vs. Stipe Miocic ,W/L
Dan Hardy  vs. Amir Sadollah ,W/L
Brad Pickett  vs. Yves Jabouin ,W/L
Paul Sass  vs. Matt Wiman ,L/W
John Hathaway  vs. John Maguire ,W/L
Che Mills  vs. Duane Ludwig ,W/L
Kyle Kingsbury  vs. Jimi Manuwa ,L/W
Andy Ogle  vs. Akira Corassani ,L/W
Tom Watson  vs. Brad Tavares ,L/W
DaMarques Johnson  vs. Gunnar Nelson ,L/W
Jason Young  vs. Robert Peralta ,L/W
Jon Jones  vs. Vitor Belfort ,W/L
Joseph Benavidez  vs. Demetrious Johnson ,L/W
Michael Bisping  vs. Brian Stann ,W/L
Matt Hamill  vs. Roger Hollett ,W/L
Cub Swanson  vs. Charles Oliveira ,W/L
Igor Pokrajac  vs. Vinny Magalhaes ,L/W
TJ Grant  vs. Evan Dunham ,W/L
Sean Pierson  vs. Lance Benoist ,W/L
Jimy Hettes  vs. Marcus Brimage ,L/W
Seth Baczynski  vs. Simeon Thoresen ,W/L
Mitch Gagnon  vs. Walel Watson ,W/L
Kyle Noke  vs. Charlie Brenneman ,W/L
Benson Henderson  vs. Frankie Edgar ,W/L
Donald Cerrone  vs. Melvin Guillard ,W/L
Jake Shields  vs. Ed Herman ,NC/NC
Yushin Okami  vs. Buddy Roberts ,W/L
Justin Lawrence  vs. Max Holloway ,L/W
Dennis Bermudez  vs. Tommy Hayden ,W/L
Jared Hamman  vs. Michael Kuiper ,L/W
Ken Stone  vs. Erik Perez ,L/W
Dustin Pague  vs. Chico Camus ,L/W
Nik Lentz  vs. Eiji Mitsuoka ,W/L
Mauricio Rua  vs. Brandon Vera ,W/L
Lyoto Machida  vs. Ryan Bader ,W/L
Joe Lauzon  vs. Jamie Varner ,W/L
Mike Swick  vs. DaMarques Johnson ,W/L
Cole Miller  vs. Nam Phan ,L/W
Phil Davis  vs. Wagner Prado ,NC/NC
Josh Grispi  vs. Rani Yahya ,L/W
Philip De Fries  vs. Oli Thompson ,W/L
Manvel Gamburyan  vs. Michihiro Omigawa ,W/L
John Moraga  vs. Ulysses Gomez ,W/L
Urijah Faber  vs. Renan Barao ,L/W
Hector Lombard  vs. Tim Boetsch ,L/W
Cheick Kongo  vs. Shawn Jordan ,W/L
Brian Ebersole  vs. James Head ,L/W
Chris Clements  vs. Matthew Riddle ,NC/NC
Court McGee  vs. Nick Ring ,L/W
Roland Delorme  vs. Francisco Rivera ,NC/NC
Anthony Perosh  vs. Ryan Jimmo ,L/W
Bryan Caraway  vs. Mitch Gagnon ,W/L
Antonio Carvalho  vs. Daniel Pineda ,W/L
Mitch Clarke  vs. Anton Kuivanen ,L/W
Mark Munoz  vs. Chris Weidman ,L/W
James Te Huna  vs. Joey Beltran ,W/L
Aaron Simpson  vs. Kenny Robertson ,W/L
Karlos Vemola  vs. Francis Carmont ,L/W
TJ Dillashaw  vs. Vaughan Lee ,W/L
Rafael Dos Anjos  vs. Anthony Njokuani ,W/L
Damacio Page  vs. Alex Caceres ,L/W
Chris Cariaso  vs. Josh Ferguson ,W/L
Rafael Natal  vs. Andrew Craig ,L/W
Marcelo Guimaraes  vs. Dan Stittgen ,W/L
Raphael Assuncao  vs. Issei Tamura ,W/L
Anderson Silva  vs. Chael Sonnen ,W/L
Forrest Griffin  vs. Tito Ortiz ,W/L
Cung Le  vs. Patrick Cote ,W/L
Dong Hyun Kim  vs. Demian Maia ,L/W
Chad Mendes  vs. Cody McKenzie ,W/L
Ivan Menjivar  vs. Mike Easton ,L/W
Melvin Guillard  vs. Fabricio Camoes ,W/L
Gleison Tibau  vs. Khabib Nurmagomedov ,L/W
Constantinos Philippou  vs. Riki Fukuda ,W/L
John Alessio  vs. Shane Roller ,L/W
Rafaello Oliveira  vs. Yoislandy Izquierdo ,W/L
Wanderlei Silva  vs. Rich Franklin ,L/W
Cezar Ferreira  vs. Sergio Moraes ,W/L
Godofredo Pepey  vs. Rony Jason ,L/W
Fabricio Werdum  vs. Mike Russow ,W/L
Iuri Alcantara  vs. Hacran Dias ,L/W
Anistavio Medeiros  vs. Rodrigo Damm ,L/W
Delson Heleno  vs. Francisco Trinaldo ,L/W
John Teixeira  vs. Hugo Viana ,L/W
Thiago Perpetuo  vs. Leonardo Mafra ,W/L
Marcos Vinicius  vs. Wagner Campos ,W/L
Felipe Arantes  vs. Milton Vieira ,D/D
Gray Maynard  vs. Clay Guida ,W/L
Sam Stout  vs. Spencer Fisher ,W/L
Brian Ebersole  vs. TJ Waldburger ,W/L
Ross Pearson  vs. Cub Swanson ,L/W
Hatsu Hioki  vs. Ricardo Lamas ,L/W
Ramsey Nijem  vs. CJ Keith ,W/L
Rick Story  vs. Brock Jardine ,W/L
Steven Siler  vs. Joey Gambino ,W/L
Nick Catone  vs. Chris Camozzi ,L/W
Matt Brown  vs. Luis Ramos ,W/L
Dan Miller  vs. Ricardo Funch ,W/L
Ken Stone  vs. Dustin Pague ,W/L
Demetrious Johnson  vs. Ian McCall ,W/L
Erick Silva  vs. Charlie Brenneman ,W/L
Mike Pyle  vs. Josh Neer ,W/L
Eddie Wineland  vs. Scott Jorgensen ,W/L
Mike Pierce  vs. Carlos Eduardo Rocha ,W/L
Seth Baczynski  vs. Lance Benoist ,W/L
Leonard Garcia  vs. Matt Grice ,L/W
Dustin Pague  vs. Jared Papazian ,W/L
Tim Means  vs. Justin Salas ,W/L
Buddy Roberts  vs. Caio Magalhaes ,W/L
Henry Martinez  vs. Bernardo Magalhaes ,W/L
Jake Hecht  vs. Sean Pierson ,L/W
Jake Ellenberger  vs. Martin Kampmann ,L/W
Michael Chiesa  vs. Al Iaquinta ,W/L
Jonathan Brookins  vs. Charles Oliveira ,L/W
Max Holloway  vs. Pat Schilling ,W/L
Justin Lawrence  vs. John Cofer ,W/L
Daron Cruickshank  vs. Chris Tickle ,W/L
Myles Jury  vs. Chris Saunders ,W/L
Cristiano Marcello  vs. Sam Sicilia ,L/W
Joe Proctor  vs. Jeremy Larsen ,W/L
John Albert  vs. Erik Perez ,L/W
Junior Dos Santos  vs. Frank Mir ,W/L
Cain Velasquez  vs. Antonio Silva ,W/L
Roy Nelson  vs. Dave Herman ,W/L
Stipe Miocic  vs. Shane del Rosario ,W/L
Stefan Struve  vs. Lavar Johnson ,W/L
Diego Brandao  vs. Darren Elkins ,L/W
Edson Barboza  vs. Jamie Varner ,L/W
Jason Miller  vs. CB Dollaway ,L/W
Dan Hardy  vs. Duane Ludwig ,W/L
Jacob Volkmann  vs. Paul Sass ,L/W
Kyle Kingsbury  vs. Glover Teixeira ,L/W
Mike Brown  vs. Daniel Pineda ,W/L
Chan Sung Jung  vs. Dustin Poirier ,W/L
Amir Sadollah  vs. Jorge Lopez ,W/L
Donald Cerrone  vs. Jeremy Stephens ,W/L
Yves Jabouin  vs. Jeff Hougland ,W/L
Igor Pokrajac  vs. Fabio Maldonado ,W/L
Jason MacDonald  vs. Tom Lawlor ,L/W
Brad Tavares  vs. Dongi Yang ,W/L
Cody McKenzie  vs. Marcus LeVesseur ,W/L
TJ Grant  vs. Carlo Prater ,W/L
Rafael Dos Anjos  vs. Kamal Shalorus ,W/L
Jeff Curran  vs. Johnny Eduardo ,L/W
Alex Soto  vs. Francisco Rivera ,L/W
Nate Diaz  vs. Jim Miller ,W/L
Josh Koscheck  vs. Johny Hendricks ,L/W
Rousimar Palhares  vs. Alan Belcher ,L/W
Pat Barry  vs. Lavar Johnson ,L/W
Tony Ferguson  vs. Michael Johnson ,L/W
John Dodson  vs. Tim Elliott ,W/L
John Hathaway  vs. Pascal Krauss ,W/L
Louis Gaudinot  vs. John Lineker ,W/L
Danny Castillo  vs. John Cholish ,W/L
Dennis Bermudez  vs. Pablo Garza ,W/L
Roland Delorme  vs. Nick Denis ,W/L
Mike Massenzio  vs. Karlos Vemola ,L/W
Jon Jones  vs. Rashad Evans ,W/L
Rory MacDonald  vs. Che Mills ,W/L
Brendan Schaub  vs. Ben Rothwell ,L/W
Miguel Torres  vs. Michael McDonald ,L/W
Mark Hominick  vs. Eddie Yagin ,L/W
Mark Bocek  vs. John Alessio ,W/L
Travis Browne  vs. Chad Griggs ,W/L
Matt Brown  vs. Stephen Thompson ,W/L
John Makdessi  vs. Anthony Njokuani ,L/W
Mac Danzig  vs. Efrain Escudero ,W/L
Keith Wisniewski  vs. Chris Clements ,L/W
Marcus Brimage  vs. Maximo Blanco ,W/L
Alexander Gustafsson  vs. Thiago Silva ,W/L
Brian Stann  vs. Alessio Sakara ,W/L
Paulo Thiago  vs. Siyar Bahadurzada ,L/W
Dennis Siver  vs. Diego Nunes ,W/L
DaMarques Johnson  vs. John Maguire ,L/W
Brad Pickett  vs. Damacio Page ,W/L
Papy Abedi  vs. James Head ,L/W
Cyrille Diabate  vs. Tom DeBlass ,W/L
Francis Carmont  vs. Magnus Cedenblad ,W/L
Reza Madadi  vs. Yoislandy Izquierdo ,W/L
Simeon Thoresen  vs. Besam Yousef ,W/L
Jason Young  vs. Eric Wisely ,W/L
Thiago Alves  vs. Martin Kampmann ,L/W
Joseph Benavidez  vs. Yasuhiro Urushitani ,W/L
Demetrious Johnson  vs. Ian McCall ,D/D
Court McGee  vs. Constantinos Philippou ,L/W
James Te Huna  vs. Aaron Rosa ,W/L
Anthony Perosh  vs. Nick Penner ,W/L
Cole Miller  vs. Steven Siler ,L/W
Kyle Noke  vs. Andrew Craig ,L/W
TJ Waldburger  vs. Jake Hecht ,W/L
Mackens Semerzier  vs. Daniel Pineda ,L/W
Oli Thompson  vs. Shawn Jordan ,L/W
Frankie Edgar  vs. Benson Henderson ,L/W
Quinton Jackson  vs. Ryan Bader ,L/W
Mark Hunt  vs. Cheick Kongo ,W/L
Yoshihiro Akiyama  vs. Jake Shields ,L/W
Yushin Okami  vs. Tim Boetsch ,L/W
Hatsu Hioki  vs. Bart Palaszewski ,W/L
Anthony Pettis  vs. Joe Lauzon ,W/L
Takanori Gomi  vs. Eiji Mitsuoka ,W/L
Norifumi Yamamoto  vs. Vaughan Lee ,L/W
Riki Fukuda  vs. Steve Cantwell ,W/L
Takeya Mizugaki  vs. Chris Cariaso ,L/W
Zhang Tiequan  vs. Issei Tamura ,L/W
Diego Sanchez  vs. Jake Ellenberger ,L/W
Stefan Struve  vs. Dave Herman ,W/L
Aaron Simpson  vs. Ronny Markes ,L/W
Stipe Miocic  vs. Philip De Fries ,W/L
TJ Dillashaw  vs. Walel Watson ,W/L
Ivan Menjivar  vs. John Albert ,W/L
Jonathan Brookins  vs. Vagner Rocha ,W/L
Anton Kuivanen  vs. Justin Salas ,L/W
Tim Means  vs. Bernardo Magalhaes ,W/L
Nick Diaz  vs. Carlos Condit ,L/W
Roy Nelson  vs. Fabricio Werdum ,L/W
Josh Koscheck  vs. Mike Pierce ,W/L
Renan Barao  vs. Scott Jorgensen ,W/L
Ed Herman  vs. Clifford Starks ,W/L
Dustin Poirier  vs. Max Holloway ,W/L
Alex Caceres  vs. Edwin Figueroa ,L/W
Matt Brown  vs. Chris Cope ,W/L
Matthew Riddle  vs. Henry Martinez ,W/L
Rafael Natal  vs. Michael Kuiper ,W/L
Dan Stittgen  vs. Stephen Thompson ,L/W
Rashad Evans  vs. Phil Davis ,W/L
Chael Sonnen  vs. Michael Bisping ,W/L
Demian Maia  vs. Chris Weidman ,L/W
Evan Dunham  vs. Nik Lentz ,W/L
Mike Russow  vs. Jon Olav Einemo ,W/L
Cub Swanson  vs. George Roop ,W/L
Charles Oliveira  vs. Eric Wisely ,W/L
Michael Johnson  vs. Shane Roller ,W/L
Joey Beltran  vs. Lavar Johnson ,L/W
Chris Camozzi  vs. Dustin Jacoby ,W/L
Melvin Guillard  vs. Jim Miller ,L/W
Duane Ludwig  vs. Josh Neer ,L/W
Mike Easton  vs. Jared Papazian ,W/L
Pat Barry  vs. Christian Morecraft ,W/L
Jorge Rivera  vs. Eric Schafer ,W/L
Kamal Shalorus  vs. Khabib Nurmagomedov ,L/W
Charlie Brenneman  vs. Daniel Roberts ,W/L
Fabricio Camoes  vs. Tommy Hayden ,W/L
Daniel Pineda  vs. Pat Schilling ,W/L
Joseph Sandoval  vs. Nick Denis ,L/W
Jose Aldo  vs. Chad Mendes ,W/L
Vitor Belfort  vs. Anthony Johnson ,W/L
Rousimar Palhares  vs. Mike Massenzio ,W/L
Erick Silva  vs. Carlo Prater ,L/W
Edson Barboza  vs. Terry Etim ,W/L
Thiago Tavares  vs. Sam Stout ,W/L
Gabriel Gonzaga  vs. Ednaldo Oliveira ,W/L
Iuri Alcantara  vs. Michihiro Omigawa ,W/L
Ricardo Funch  vs. Mike Pyle ,L/W
Felipe Arantes  vs. Antonio Carvalho ,W/L
Brock Lesnar  vs. Alistair Overeem ,L/W
Nate Diaz  vs. Donald Cerrone ,W/L
Jon Fitch  vs. Johny Hendricks ,L/W
Vladimir Matyushenko  vs. Alexander Gustafsson ,L/W
Nam Phan  vs. Jimy Hettes ,L/W
Ross Pearson  vs. Junior Assuncao ,W/L
Anthony Njokuani  vs. Danny Castillo ,L/W
Dong Hyun Kim  vs. Sean Pierson ,W/L
Jacob Volkmann  vs. Efrain Escudero ,W/L
Manvel Gamburyan  vs. Diego Nunes ,L/W
Jon Jones  vs. Lyoto Machida ,W/L
Frank Mir  vs. Antonio Rodrigo Nogueira ,W/L
Tito Ortiz  vs. Rogerio Nogueira ,L/W
Claude Patrick  vs. Brian Ebersole ,L/W
Mark Hominick  vs. Chan Sung Jung ,L/W
Krzysztof Soszynski  vs. Igor Pokrajac ,L/W
Jared Hamman  vs. Constantinos Philippou ,L/W
John Makdessi  vs. Dennis Hallman ,L/W
Walel Watson  vs. Yves Jabouin ,L/W
Mark Bocek  vs. Nik Lentz ,W/L
Rich Attonito  vs. Jake Hecht ,L/W
Mitch Clarke  vs. John Cholish ,L/W
Michael Bisping  vs. Jason Miller ,W/L
Diego Brandao  vs. Dennis Bermudez ,W/L
TJ Dillashaw  vs. John Dodson ,L/W
Tony Ferguson  vs. Yves Edwards ,W/L
Louis Gaudinot  vs. Johnny Bedford ,L/W
Marcus Brimage  vs. Stephen Bass ,W/L
Dustin Pague  vs. John Albert ,L/W
Roland Delorme  vs. Josh Ferguson ,W/L
Steven Siler  vs. Josh Clopton ,W/L
Bryan Caraway  vs. Dustin Neace ,W/L
Mauricio Rua  vs. Dan Henderson ,L/W
Wanderlei Silva  vs. Cung Le ,W/L
Urijah Faber  vs. Brian Bowles ,W/L
Rick Story  vs. Martin Kampmann ,L/W
Stephan Bonnar  vs. Kyle Kingsbury ,W/L
Ryan Bader  vs. Jason Brilz ,W/L
Michael McDonald  vs. Alex Soto ,W/L
Tom Lawlor  vs. Chris Weidman ,L/W
Gleison Tibau  vs. Rafael Dos Anjos ,W/L
Miguel Torres  vs. Nick Pace ,W/L
Matt Brown  vs. Seth Baczynski ,L/W
Danny Castillo  vs. Shamar Bailey ,W/L
Cain Velasquez  vs. Junior Dos Santos ,L/W
Clay Guida  vs. Benson Henderson ,L/W
Dustin Poirier  vs. Pablo Garza ,W/L
Cub Swanson  vs. Ricardo Lamas ,L/W
DaMarques Johnson  vs. Clay Harvison ,W/L
Norifumi Yamamoto  vs. Darren Uyenoyama ,L/W
Mackens Semerzier  vs. Robert Peralta ,NC/NC
Alex Caceres  vs. Cole Escovedo ,W/L
Mike Pierce  vs. Paul Bradley ,W/L
Aaron Rosa  vs. Matt Lucas ,W/L
Chris Leben  vs. Mark Munoz ,L/W
Brad Pickett  vs. Renan Barao ,L/W
Thiago Alves  vs. Papy Abedi ,W/L
Cyrille Diabate  vs. Anthony Perosh ,L/W
Terry Etim  vs. Edward Faaloloto ,W/L
John Maguire  vs. Justin Edwards ,W/L
Rob Broughton  vs. Philip De Fries ,L/W
Michihiro Omigawa  vs. Jason Young ,W/L
Chris Cope  vs. Che Mills ,L/W
Chris Cariaso  vs. Vaughan Lee ,W/L
BJ Penn  vs. Nick Diaz ,L/W
Cheick Kongo  vs. Matt Mitrione ,W/L
Mirko Filipovic  vs. Roy Nelson ,L/W
Scott Jorgensen  vs. Jeff Curran ,W/L
Hatsu Hioki  vs. George Roop ,W/L
Dennis Siver  vs. Donald Cerrone ,L/W
Tyson Griffin  vs. Bart Palaszewski ,L/W
Brandon Vera  vs. Eliot Marshall ,W/L
Ramsey Nijem  vs. Danny Downes ,W/L
Chris Camozzi  vs. Francis Carmont ,L/W
Dustin Jacoby  vs. Clifford Starks ,L/W
Frankie Edgar  vs. Gray Maynard ,W/L
Jose Aldo  vs. Kenny Florian ,W/L
Chael Sonnen  vs. Brian Stann ,W/L
Leonard Garcia  vs. Nam Phan ,L/W
Melvin Guillard  vs. Joe Lauzon ,L/W
Demian Maia  vs. Jorge Santiago ,W/L
Anthony Pettis  vs. Jeremy Stephens ,W/L
Joey Beltran  vs. Stipe Miocic ,L/W
Zhang Tiequan  vs. Darren Elkins ,L/W
Aaron Simpson  vs. Eric Schafer ,W/L
Steve Cantwell  vs. Mike Massenzio ,L/W
Dominick Cruz  vs. Demetrious Johnson ,W/L
Pat Barry  vs. Stefan Struve ,L/W
