Fight,OUTCOME
Marco Beltran  vs. Reginaldo Vieira ,W/L
Vicente Luque  vs. Alvaro Herrera Mendoza ,W/L
Rory MacDonald  vs. Stephen Thompson ,L/W
Donald Cerrone  vs. Patrick Cote ,W/L
Steve Bosse  vs. Sean O'Connell ,W/L
Olivier Aubin-Mercier  vs. Thibault Gouti ,W/L
Valerie Letourneau  vs. Joanne Wood ,L/W
Jason Saggo  vs. Leandro Silva ,W/L
Misha Cirkunov  vs. Ion Cutelaba ,W/L
Tamdan McCrory  vs. Krzysztof Jotko ,L/W
Chris Beal  vs. Joe Soto ,L/W
Elias Theodorou  vs. Sam Alvey ,W/L
Randa Markos  vs. Jocelyn Jones-Lybarger ,W/L
Colby Covington  vs. Jonathan Meunier ,W/L
Ali Bagautinov  vs. Geane Herrera ,W/L
Luke Rockhold  vs. Michael Bisping ,L/W
Dominick Cruz  vs. Urijah Faber ,W/L
Max Holloway  vs. Ricardo Lamas ,W/L
Dan Henderson  vs. Hector Lombard ,W/L
Dustin Poirier  vs. Bobby Green ,W/L
Brian Ortega  vs. Clay Guida ,W/L
Beneil Dariush  vs. James Vick ,W/L
Jessica Penne  vs. Jessica Andrade ,L/W
Cole Miller  vs. Alex Caceres ,L/W
Sean Strickland  vs. Tom Breese ,W/L
Jonathan Wilson  vs. Henrique da Silva ,L/W
Kevin Casey  vs. Elvis Mutapcic ,D/D
Marco Polo Reyes  vs. Dong Hyun Ma ,W/L
Thomas Almeida  vs. Cody Garbrandt ,L/W
Renan Barao  vs. Jeremy Stephens ,L/W
Tarec Saffiedine  vs. Rick Story ,L/W
Chris Camozzi  vs. Vitor Miranda ,W/L
Jorge Masvidal  vs. Lorenz Larkin ,L/W
Joshua Burkman  vs. Paul Felder ,L/W
Sara McMann  vs. Jessica Eye ,W/L
Abel Trujillo  vs. Jordan Rinaldi ,W/L
Jake Collier  vs. Alberto Uda ,W/L
Erik Koch  vs. Shane Campbell ,W/L
Aljamain Sterling  vs. Bryan Caraway ,L/W
Chris de la Rocha  vs. Adam Milstead ,L/W
Fabricio Werdum  vs. Stipe Miocic ,L/W
Jacare Souza  vs. Vitor Belfort ,W/L
Cristiane Justino  vs. Leslie Smith ,W/L
Mauricio Rua  vs. Corey Anderson ,W/L
Warlley Alves  vs. Bryan Barberena ,L/W
Demian Maia  vs. Matt Brown ,W/L
Thiago Santos  vs. Nate Marquardt ,W/L
Francisco Trinaldo  vs. Yancy Medeiros ,W/L
John Lineker  vs. Rob Font ,W/L
Rogerio Nogueira  vs. Patrick Cummins ,W/L
Sergio Moraes  vs. Luan Chagas ,D/D
Renato Moicano  vs. Zubaira Tukhugov ,W/L
Alistair Overeem  vs. Andrei Arlovski ,W/L
Antonio Silva  vs. Stefan Struve ,L/W
Albert Tumenov  vs. Gunnar Nelson ,L/W
Germaine de Randamie  vs. Anna Elmose ,W/L
Nikita Krylov  vs. Francimar Barroso ,W/L
Karolina Kowalkiewicz  vs. Heather Clark ,W/L
Rustam Khabilov  vs. Chris Wade ,W/L
Magnus Cedenblad  vs. Garreth McLellan ,W/L
Jon Tuck  vs. Josh Emmett ,L/W
Yan Cabral  vs. Reza Madadi ,L/W
Kyoji Horiguchi  vs. Neil Seery ,W/L
Leon Edwards  vs. Dominic Waters ,W/L
Yuta Sasaki  vs. Willie Gates ,W/L
Jon Jones  vs. Ovince Saint Preux ,W/L
Demetrious Johnson  vs. Henry Cejudo ,W/L
Anthony Pettis  vs. Edson Barboza ,L/W
Robert Whittaker  vs. Rafael Natal ,W/L
Yair Rodriguez  vs. Andre Fili ,W/L
Sergio Pettis  vs. Chris Kelades ,W/L
Danny Roberts  vs. Dominique Steele ,W/L
Carla Esparza  vs. Juliana Lima ,W/L
Glaico Franca Moreira  vs. James Vick ,L/W
Walt Harris  vs. Cody East ,W/L
Marcos Rogerio de Lima  vs. Clint Hester ,W/L
Efrain Escudero  vs. Kevin Lee ,L/W
Glover Teixeira  vs. Rashad Evans ,W/L
Rose Namajunas  vs. Tecia Torres ,W/L
Khabib Nurmagomedov  vs. Darrell Horcher ,W/L
Cub Swanson  vs. Hacran Dias ,W/L
Beneil Dariush  vs. Michael Chiesa ,L/W
Bethe Correia  vs. Raquel Pennington ,L/W
Court McGee  vs. Santiago Ponzinibbio ,L/W
Randy Brown  vs. Michael Graves ,L/W
John Dodson  vs. Manvel Gamburyan ,W/L
Oluwale Bamgbose  vs. Cezar Ferreira ,L/W
Elizeu Zaleski dos Santos  vs. Omari Akhmedov ,W/L
Ben Rothwell  vs. Junior Dos Santos ,L/W
Derrick Lewis  vs. Gabriel Gonzaga ,W/L
Francis Ngannou  vs. Curtis Blaydes ,W/L
Timothy Johnson  vs. Marcin Tybura ,W/L
Igor Pokrajac  vs. Jan Blachowicz ,L/W
Maryna Moroz  vs. Cristina Stanciu ,W/L
Nicolas Dalby  vs. Zak Cummings ,L/W
Ian Entwistle  vs. Alejandro Perez ,L/W
Mairbek Taisumov  vs. Damir Hadzovic ,W/L
Filip Pejic  vs. Damian Stasiak ,L/W
Robert Whiteford  vs. Lucas Martins ,L/W
Jared Cannonier  vs. Cyril Asker ,W/L
Alessio Di Chirico  vs. Bojan Velickovic ,L/W
Mark Hunt  vs. Frank Mir ,W/L
Hector Lombard  vs. Neil Magny ,L/W
Jake Matthews  vs. Johnny Case ,W/L
Daniel Kelly  vs. Antonio Carlos Junior ,W/L
James Te Huna  vs. Steve Bosse ,L/W
Bec Rawlings  vs. Seo Hee Ham ,W/L
Brendan O'Reilly  vs. Alan Jouban ,L/W
Dan Hooker  vs. Mark Eddiva ,W/L
Leslie Smith  vs. Rin Nakai ,W/L
Richard Walsh  vs. Viscardi Andrade ,L/W
Ross Pearson  vs. Chad Laprise ,W/L
Alan Patrick  vs. Damien Brown ,W/L
Conor McGregor  vs. Nate Diaz ,L/W
Holly Holm  vs. Miesha Tate ,L/W
Gian Villante  vs. Ilir Latifi ,L/W
Corey Anderson  vs. Tom Lawlor ,W/L
Amanda Nunes  vs. Valentina Shevchenko ,W/L
Brandon Thatch  vs. Siyar Bahadurzada ,L/W
Erick Silva  vs. Nordine Taleb ,L/W
Vitor Miranda  vs. Marcelo Guimaraes ,W/L
Darren Elkins  vs. Chas Skelly ,W/L
Diego Sanchez  vs. Jim Miller ,W/L
Jason Saggo  vs. Justin Salas ,W/L
Julian Erosa  vs. Teruto Ishihara ,L/W
Anderson Silva  vs. Michael Bisping ,L/W
Gegard Mousasi  vs. Thales Leites ,W/L
Tom Breese  vs. Keita Nakamura ,W/L
Francisco Rivera  vs. Brad Pickett ,L/W
Mike Wilkinson  vs. Makwan Amirkhani ,L/W
Davey Grant  vs. Marlon Vera ,W/L
Scott Askham  vs. Chris Dempsey ,W/L
Arnold Allen  vs. Yaotzin Meza ,W/L
Brad Scott  vs. Krzysztof Jotko ,L/W
Norman Parke  vs. Rustam Khabilov ,L/W
Daniel Omielanczuk  vs. Jarjis Danho ,W/L
Teemu Packalen  vs. Thibault Gouti ,W/L
David Teymur  vs. Martin Svensson ,W/L
Donald Cerrone  vs. Alex Oliveira ,W/L
Derek Brunson  vs. Roan Carneiro ,W/L
Cody Garbrandt  vs. Augusto Mendes ,W/L
Dennis Bermudez  vs. Tatsuya Kawajiri ,W/L
Chris Camozzi  vs. Joe Riggs ,W/L
James Krause  vs. Shane Campbell ,W/L
Alex Garcia  vs. Sean Strickland ,L/W
Daniel Sarafian  vs. Oluwale Bamgbose ,L/W
Anthony Smith  vs. Leonardo Guimaraes ,W/L
Jonavin Webb  vs. Nathan Coy ,L/W
Marion Reneau  vs. Ashlee Evans-Smith ,L/W
Lauren Murphy  vs. Kelly Faszholz ,W/L
Anthony Hamilton  vs. Shamil Abdurakhimov ,L/W
Johny Hendricks  vs. Stephen Thompson ,L/W
Roy Nelson  vs. Jared Rosholt ,W/L
Ovince Saint Preux  vs. Rafael Cavalcante ,W/L
Joseph Benavidez  vs. Zach Makovsky ,W/L
Misha Cirkunov  vs. Alex Nicholson ,W/L
Mike Pyle  vs. Sean Spencer ,W/L
Joshua Burkman  vs. KJ Noons ,W/L
Derrick Lewis  vs. Damian Grabowski ,W/L
Ray Borg  vs. Justin Scoggins ,L/W
Noad Lahat  vs. Diego Rivas ,L/W
Mickey Gall  vs. Mike Jackson ,W/L
Artem Lobov  vs. Alex White ,L/W
Anthony Johnson  vs. Ryan Bader ,W/L
Josh Barnett  vs. Ben Rothwell ,L/W
Iuri Alcantara  vs. Jimmie Rivera ,L/W
Sage Northcutt  vs. Bryan Barberena ,L/W
Tarec Saffiedine  vs. Jake Ellenberger ,W/L
Olivier Aubin-Mercier  vs. Diego Ferreira ,L/W
Rafael Natal  vs. Kevin Casey ,W/L
Dustin Ortiz  vs. Wilson Reis ,L/W
George Sullivan  vs. Alexander Yakovlev ,L/W
Alex Caceres  vs. Masio Fullen ,W/L
Matt Dwyer  vs. Randy Brown ,L/W
Damon Jackson  vs. Levan Makashvili ,D/D
Anthony Rocco Martin  vs. Felipe Olivieri ,W/L
TJ Dillashaw  vs. Dominick Cruz ,L/W
Anthony Pettis  vs. Eddie Alvarez ,L/W
Travis Browne  vs. Matt Mitrione ,W/L
Ross Pearson  vs. Francisco Trinaldo ,L/W
Patrick Cote  vs. Ben Saunders ,W/L
Tim Boetsch  vs. Ed Herman ,L/W
Chris Wade  vs. Mehdi Baghdad ,W/L
Maximo Blanco  vs. Luke Sanders ,L/W
Paul Felder  vs. Daron Cruickshank ,W/L
Ilir Latifi  vs. Sean O'Connell ,W/L
Charles Rosa  vs. Kyle Bochniak ,W/L
Rob Font  vs. Joey Gomez ,W/L
Francimar Barroso  vs. Elvis Mutapcic ,W/L
Robbie Lawler  vs. Carlos Condit ,W/L
Stipe Miocic  vs. Andrei Arlovski ,W/L
Lorenz Larkin  vs. Albert Tumenov ,L/W
Diego Brandao  vs. Brian Ortega ,L/W
Abel Trujillo  vs. Tony Sims ,W/L
Michael McDonald  vs. Masanori Kanehara ,W/L
Kyle Noke  vs. Alex Morono ,L/W
Justine Kish  vs. Nina Nunes ,W/L
Scott Holtzman  vs. Drew Dober ,L/W
Dustin Poirier  vs. Joe Duffy ,W/L
Joe Soto  vs. Michinori Tanaka ,L/W
Sheldon Westcott  vs. Edgar Garcia ,W/L
Rafael Dos Anjos  vs. Donald Cerrone ,W/L
Junior Dos Santos  vs. Alistair Overeem ,L/W
Michael Johnson  vs. Nate Diaz ,L/W
Randa Markos  vs. Karolina Kowalkiewicz ,L/W
Charles Oliveira  vs. Myles Jury ,W/L
CB Dollaway  vs. Nate Marquardt ,L/W
Sarah Kaufman  vs. Valentina Shevchenko ,L/W
Josh Samman  vs. Tamdan McCrory ,L/W
Nik Lentz  vs. Danny Castillo ,W/L
Cole Miller  vs. Jim Alers ,NC/NC
Kamaru Usman  vs. Leon Edwards ,W/L
Hayder Hassan  vs. Vicente Luque ,L/W
Francis Ngannou  vs. Luis Henrique ,W/L
Jose Aldo  vs. Conor McGregor ,L/W
Chris Weidman  vs. Luke Rockhold ,L/W
Jacare Souza  vs. Yoel Romero ,L/W
Demian Maia  vs. Gunnar Nelson ,W/L
Max Holloway  vs. Jeremy Stephens ,W/L
Urijah Faber  vs. Frankie Saenz ,W/L
Tecia Torres  vs. Jocelyn Jones-Lybarger ,W/L
Warlley Alves  vs. Colby Covington ,W/L
Leonardo Santos  vs. Kevin Lee ,W/L
Joe Proctor  vs. Magomed Mustafaev ,L/W
John Makdessi  vs. Yancy Medeiros ,L/W
Court McGee  vs. Marcio Alexandre Junior ,W/L
Frankie Edgar  vs. Chad Mendes ,W/L
Artem Lobov  vs. Ryan Hall ,L/W
Edson Barboza  vs. Tony Ferguson ,L/W
Joe Lauzon  vs. Evan Dunham ,L/W
Tatsuya Kawajiri  vs. Jason Knight ,W/L
Julian Erosa  vs. Marcin Wrzosek ,W/L
Gabriel Gonzaga  vs. Konstantin Erokhin ,W/L
Ryan LaFlare  vs. Mike Pierce ,W/L
Joby Sanchez  vs. Geane Herrera ,L/W
Chris Gruetzemacher  vs. Abner Lloveras ,W/L
Rose Namajunas  vs. Paige VanZant ,W/L
Jim Miller  vs. Michael Chiesa ,L/W
Sage Northcutt  vs. Cody Pfister ,W/L
Elias Theodorou  vs. Thiago Santos ,L/W
Tim Means  vs. John Howard ,W/L
Omari Akhmedov  vs. Sergio Moraes ,L/W
Antonio Carlos Junior  vs. Kevin Casey ,NC/NC
Aljamain Sterling  vs. Johnny Eduardo ,W/L
Santiago Ponzinibbio  vs. Andreas Stahl ,W/L
Danny Roberts  vs. Nathan Coy ,W/L
Zubaira Tukhugov  vs. Phillipe Nover ,W/L
Kailin Curran  vs. Emily Kagan ,W/L
Benson Henderson  vs. Jorge Masvidal ,W/L
Dong Hyun Kim  vs. Dominic Waters ,W/L
Yoshihiro Akiyama  vs. Alberto Mina ,L/W
Dooho Choi  vs. Sam Sicilia ,W/L
Dongi Yang  vs. Jake Collier ,W/L
Yui Chul Nam  vs. Mike de la Torre ,L/W
Tae Hyun Bang  vs. Leo Kuntz ,W/L
Seo Hee Ham  vs. Cortney Casey ,W/L
Yao Zhikui  vs. Fredy Serrano ,L/W
Guangyou Ning  vs. Marco Beltran ,L/W
Dominique Steele  vs. Dong Hyun Ma ,W/L
Neil Magny  vs. Kelvin Gastelum ,W/L
Ricardo Lamas  vs. Diego Sanchez ,W/L
Jussier Formiga  vs. Henry Cejudo ,L/W
Erick Montano  vs. Enrique Marin ,W/L
Horacio Gutierrez  vs. Enrique Barzola ,L/W
Efrain Escudero  vs. Leandro Silva ,L/W
Erik Perez  vs. Taylor Lapilus ,W/L
Hector Urbina  vs. Bartosz Fabinski ,L/W
Alejandro Perez  vs. Scott Jorgensen ,W/L
Gabriel Benitez  vs. Andre Fili ,L/W
Vernon Ramos Ho  vs. Alvaro Herrera Mendoza ,L/W
Cesar Arzamendia  vs. Marco Polo Reyes ,L/W
Valmir Lazaro  vs. Michel Prazeres ,L/W
Ronda Rousey  vs. Holly Holm ,L/W
Joanna Jedrzejczyk  vs. Valerie Letourneau ,W/L
Mark Hunt  vs. Antonio Silva ,W/L
Uriah Hall  vs. Robert Whittaker ,L/W
Stefan Struve  vs. Jared Rosholt ,L/W
Jake Matthews  vs. Akbarh Arreola ,W/L
Kyle Noke  vs. Peter Sobotta ,W/L
Anthony Perosh  vs. Gian Villante ,L/W
Richie Vaculik  vs. Danny Martinez ,L/W
Daniel Kelly  vs. Steve Montgomery ,W/L
Richard Walsh  vs. Steve Kennedy ,W/L
James Moontasri  vs. Anton Zafir ,W/L
Ben Nguyen  vs. Ryan Benoit ,W/L
Vitor Belfort  vs. Dan Henderson ,W/L
Glover Teixeira  vs. Patrick Cummins ,W/L
Thomas Almeida  vs. Anthony Birchak ,W/L
Alex Oliveira  vs. Piotr Hallmann ,W/L
Gilbert Burns  vs. Rashid Magomedov ,L/W
Fabio Maldonado  vs. Corey Anderson ,L/W
Gleison Tibau  vs. Abel Trujillo ,L/W
Yan Cabral  vs. Johnny Case ,L/W
Clay Guida  vs. Thiago Tavares ,L/W
Edimilson Souza  vs. Chas Skelly ,L/W
Viscardi Andrade  vs. Gasan Umalatov ,W/L
Pedro Munhoz  vs. Jimmie Rivera ,L/W
Bruno Korea  vs. Matheus Nicolau ,L/W
Paddy Holohan  vs. Louis Smolka ,L/W
Norman Parke  vs. Reza Madadi ,W/L
Nicolas Dalby  vs. Darren Till ,D/D
Neil Seery  vs. Jon Delos Reyes ,W/L
Stevie Ray  vs. Mickael Lebout ,W/L
Aisling Daly  vs. Ericka Almeida ,W/L
Scott Askham  vs. Krzysztof Jotko ,L/W
Cathal Pendred  vs. Tom Breese ,L/W
Darren Elkins  vs. Robert Whiteford ,W/L
Bubba Bush  vs. Garreth McLellan ,L/W
Daniel Cormier  vs. Alexander Gustafsson ,W/L
Ryan Bader  vs. Rashad Evans ,W/L
Shawn Jordan  vs. Ruslan Magomedov ,L/W
Joseph Benavidez  vs. Ali Bagautinov ,W/L
Jessica Eye  vs. Julianna Pena ,L/W
Yair Rodriguez  vs. Dan Hooker ,W/L
Alan Jouban  vs. Albert Tumenov ,L/W
Adriano Martins  vs. Islam Makhachev ,W/L
Rose Namajunas  vs. Angela Hill ,W/L
Francisco Trevino  vs. Sage Northcutt ,L/W
Chris Cariaso  vs. Sergio Pettis ,L/W
Derrick Lewis  vs. Viktor Pesta ,W/L
Josh Barnett  vs. Roy Nelson ,W/L
Gegard Mousasi  vs. Uriah Hall ,L/W
Kyoji Horiguchi  vs. Chico Camus ,W/L
Takeya Mizugaki  vs. George Roop ,W/L
Katsunori Kikuno  vs. Diego Brandao ,L/W
Mizuto Hirota  vs. Teruto Ishihara ,D/D
Keita Nakamura  vs. Li Jingliang ,W/L
Nick Hein  vs. Yusuke Kasuya ,W/L
Naoyuki Kotani  vs. Kajan Johnson ,L/W
Shinsho Anzai  vs. Roger Zapata ,W/L
Demetrious Johnson  vs. John Dodson ,W/L
Andrei Arlovski  vs. Frank Mir ,W/L
Anthony Johnson  vs. Jimi Manuwa ,W/L
Jan Blachowicz  vs. Corey Anderson ,L/W
Paige VanZant  vs. Alex Chambers ,W/L
Ross Pearson  vs. Paul Felder ,W/L
Francisco Rivera  vs. John Lineker ,L/W
Jessica Andrade  vs. Raquel Pennington ,L/W
Clay Collard  vs. Tiago dos Santos e Silva ,L/W
Joe Riggs  vs. Ron Stallings ,W/L
Joaquim Silva  vs. Nazareno Malegarie ,W/L
Max Holloway  vs. Charles Oliveira ,W/L
Neil Magny  vs. Erick Silva ,W/L
Patrick Cote  vs. Joshua Burkman ,W/L
Chad Laprise  vs. Francisco Trinaldo ,L/W
Olivier Aubin-Mercier  vs. Tony Sims ,W/L
Maryna Moroz  vs. Valerie Letourneau ,L/W
Sam Stout  vs. Frankie Perez ,L/W
Yves Jabouin  vs. Felipe Arantes ,L/W
Marcos Rogerio de Lima  vs. Nikita Krylov ,L/W
Chris Kelades  vs. Chris Beal ,W/L
Shane Campbell  vs. Elias Silverio ,W/L
Misha Cirkunov  vs. Daniel Jolly ,W/L
Glover Teixeira  vs. Ovince Saint Preux ,W/L
Michael Johnson  vs. Beneil Dariush ,L/W
Derek Brunson  vs. Sam Alvey ,W/L
Jared Rosholt  vs. Timothy Johnson ,W/L
Sara McMann  vs. Amanda Nunes ,L/W
Ray Borg  vs. Geane Herrera ,W/L
Uriah Hall  vs. Oluwale Bamgbose ,W/L
Chris Camozzi  vs. Tom Watson ,W/L
Dustin Ortiz  vs. Willie Gates ,W/L
Frankie Saenz  vs. Sirwan Kakai ,W/L
Chris Dempsey  vs. Jonathan Wilson ,L/W
Marlon Vera  vs. Roman Salazar ,W/L
Anthony Christodoulou  vs. Scott Holtzman ,L/W
Ronda Rousey  vs. Bethe Correia ,W/L
Mauricio Rua  vs. Rogerio Nogueira ,W/L
Glaico Franca Moreira  vs. Fernando Bruno ,W/L
Reginaldo Vieira  vs. Dileno Lopes ,W/L
Stefan Struve  vs. Antonio Rodrigo Nogueira ,W/L
Antonio Silva  vs. Soa Palelei ,W/L
Claudia Gadelha  vs. Jessica Aguilar ,W/L
Demian Maia  vs. Neil Magny ,W/L
Rafael Cavalcante  vs. Patrick Cummins ,L/W
Warlley Alves  vs. Nordine Taleb ,W/L
Iuri Alcantara  vs. Leandro Issa ,W/L
Vitor Miranda  vs. Clint Hester ,W/L
Hugo Viana  vs. Guido Cannetti ,L/W
TJ Dillashaw  vs. Renan Barao ,W/L
Miesha Tate  vs. Jessica Eye ,W/L
Edson Barboza  vs. Paul Felder ,W/L
Joe Lauzon  vs. Takanori Gomi ,W/L
Gian Villante  vs. Tom Lawlor ,L/W
Jim Miller  vs. Danny Castillo ,W/L
Kenny Robertson  vs. Ben Saunders ,L/W
Eddie Wineland  vs. Bryan Caraway ,L/W
Daron Cruickshank  vs. James Krause ,L/W
Ramsey Nijem  vs. Andrew Holbrook ,L/W
Jessamyn Duke  vs. Elizabeth Phillips ,L/W
Zak Cummings  vs. Dominique Steele ,W/L
Michael Bisping  vs. Thales Leites ,W/L
Ross Pearson  vs. Evan Dunham ,L/W
Joe Duffy  vs. Ivan Jorge ,W/L
Joanne Wood  vs. Cortney Casey ,W/L
Leon Edwards  vs. Pawel Pawlak ,W/L
Stevie Ray  vs. Leonardo Mafra ,W/L
Paddy Holohan  vs. Vaughan Lee ,W/L
Ilir Latifi  vs. Hans Stringer ,W/L
Mickael Lebout  vs. Teemu Packalen ,W/L
Robert Whiteford  vs. Paul Redmond ,W/L
Marcus Brimage  vs. Jimmie Rivera ,L/W
Daniel Omielanczuk  vs. Chris de la Rocha ,W/L
Frank Mir  vs. Todd Duffee ,W/L
Josh Thomson  vs. Tony Ferguson ,L/W
Holly Holm  vs. Marion Reneau ,W/L
Scott Jorgensen  vs. Manvel Gamburyan ,L/W
Kevin Lee  vs. James Moontasri ,W/L
Alan Jouban  vs. Matt Dwyer ,W/L
Sam Sicilia  vs. Yaotzin Meza ,W/L
Jessica Andrade  vs. Sarah Moras ,W/L
Rani Yahya  vs. Masanori Kanehara ,W/L
Igor Araujo  vs. Sean Strickland ,L/W
Kevin Casey  vs. Ildemar Alcantara ,W/L
Andrew Craig  vs. Lyman Good ,L/W
Jake Ellenberger  vs. Stephen Thompson ,L/W
Kamaru Usman  vs. Hayder Hassan ,W/L
Michael Graves  vs. Vicente Luque ,W/L
Jorge Masvidal  vs. Cezar Ferreira ,W/L
Angela Magana  vs. Michelle Waterson ,L/W
Maximo Blanco  vs. Mike de la Torre ,W/L
Josh Samman  vs. Caio Magalhaes ,W/L
Russell Doane  vs. Jerrod Sanders ,L/W
Dan Miller  vs. Trevor Smith ,L/W
George Sullivan  vs. Dominic Waters ,W/L
Darrell Montague  vs. Willie Gates ,L/W
Chad Mendes  vs. Conor McGregor ,L/W
Robbie Lawler  vs. Rory MacDonald ,W/L
Dennis Bermudez  vs. Jeremy Stephens ,L/W
Gunnar Nelson  vs. Brandon Thatch ,W/L
Brad Pickett  vs. Thomas Almeida ,L/W
Matt Brown  vs. Tim Means ,W/L
Mike Swick  vs. Alex Garcia ,L/W
Cathal Pendred  vs. John Howard ,L/W
Cody Garbrandt  vs. Henry Briones ,W/L
Neil Seery  vs. Louis Smolka ,L/W
Yosdenis Cedeno  vs. Cody Pfister ,L/W
Lyoto Machida  vs. Yoel Romero ,L/W
Santiago Ponzinibbio  vs. Lorenz Larkin ,L/W
Antonio Carlos Junior  vs. Eddie Gordon ,W/L
Thiago Santos  vs. Steve Bosse ,W/L
Hacran Dias  vs. Levan Makashvili ,W/L
Alex Oliveira  vs. Joe Merritt ,W/L
Leandro Silva  vs. Lewis Gonzalez ,W/L
Steve Montgomery  vs. Tony Sims ,L/W
Danny Martinez  vs. Sirwan Kakai ,L/W
Joanna Jedrzejczyk  vs. Jessica Penne ,W/L
Dennis Siver  vs. Tatsuya Kawajiri ,L/W
Peter Sobotta  vs. Steve Kennedy ,W/L
Nick Hein  vs. Lukasz Sajewski ,W/L
Makwan Amirkhani  vs. Masio Fullen ,W/L
Mairbek Taisumov  vs. Alan Patrick ,W/L
Alan Omer  vs. Arnold Allen ,L/W
Niklas Backstrom  vs. Noad Lahat ,L/W
Scott Askham  vs. Antonio Dos Santos ,W/L
Piotr Hallmann  vs. Magomed Mustafaev ,L/W
Taylor Lapilus  vs. Yuta Sasaki ,W/L
Cain Velasquez  vs. Fabricio Werdum ,L/W
Gilbert Melendez  vs. Eddie Alvarez ,L/W
Kelvin Gastelum  vs. Nate Marquardt ,W/L
Yair Rodriguez  vs. Charles Rosa ,W/L
Tecia Torres  vs. Angela Hill ,W/L
Henry Cejudo  vs. Chico Camus ,W/L
Efrain Escudero  vs. Drew Dober ,W/L
Alejandro Perez  vs. Patrick Williams ,L/W
Francisco Trevino  vs. Johnny Case ,L/W
Augusto Montano  vs. Cathal Pendred ,L/W
Gabriel Benitez  vs. Clay Collard ,W/L
Tim Boetsch  vs. Dan Henderson ,L/W
Ben Rothwell  vs. Matt Mitrione ,W/L
Dustin Poirier  vs. Yancy Medeiros ,W/L
Thiago Tavares  vs. Brian Ortega ,L/W
Joe Soto  vs. Anthony Birchak ,L/W
Francisco Rivera  vs. Alex Caceres ,W/L
Shawn Jordan  vs. Derrick Lewis ,W/L
Brian Ebersole  vs. Omari Akhmedov ,L/W
Chris Wade  vs. Christos Giagos ,W/L
Joe Proctor  vs. Justin Edwards ,W/L
Ricardo Abreu  vs. Jake Collier ,L/W
Jose Quinonez  vs. Leonardo Morales ,W/L
Carlos Condit  vs. Thiago Alves ,W/L
Nik Lentz  vs. Charles Oliveira ,L/W
KJ Noons  vs. Alex Oliveira ,L/W
Francimar Barroso  vs. Ryan Jimmo ,W/L
Francisco Trinaldo  vs. Norman Parke ,W/L
Wendell Oliveira Marques  vs. Darren Till ,L/W
Rony Jason  vs. Damon Jackson ,NC/NC
Jussier Formiga  vs. Wilson Reis ,W/L
Elizeu Zaleski dos Santos  vs. Nicolas Dalby ,L/W
Lucas Martins  vs. Mirsad Bektic ,L/W
Juliana Lima  vs. Ericka Almeida ,W/L
Luiz Dutra  vs. Tom Breese ,L/W
Anthony Johnson  vs. Daniel Cormier ,L/W
Chris Weidman  vs. Vitor Belfort ,W/L
Donald Cerrone  vs. John Makdessi ,W/L
Travis Browne  vs. Andrei Arlovski ,L/W
Joseph Benavidez  vs. John Moraga ,W/L
John Dodson  vs. Zach Makovsky ,W/L
Dong Hyun Kim  vs. Joshua Burkman ,W/L
Uriah Hall  vs. Rafael Natal ,L/W
Mike Pyle  vs. Colby Covington ,L/W
Islam Makhachev  vs. Leo Kuntz ,W/L
Justin Scoggins  vs. Josh Sampo ,W/L
Frankie Edgar  vs. Urijah Faber ,W/L
Gegard Mousasi  vs. Constantinos Philippou ,W/L
Mark Munoz  vs. Luke Barnatt ,W/L
Hyun Gyu Lim  vs. Neil Magny ,L/W
Phillipe Nover  vs. Yui Chul Nam ,W/L
Mark Eddiva  vs. Levan Makashvili ,L/W
Tae Hyun Bang  vs. Jon Tuck ,L/W
Zhang Lipeng  vs. Kajan Johnson ,L/W
Li Jingliang  vs. Dhiego Lima ,W/L
Guangyou Ning  vs. Royston Wee ,W/L
Roldan Sangcha'an  vs. Jon Delos Reyes ,L/W
Nolan Ticman  vs. Yao Zhikui ,L/W
Stipe Miocic  vs. Mark Hunt ,W/L
Brad Tavares  vs. Robert Whittaker ,L/W
Anthony Perosh  vs. Sean O'Connell ,L/W
Jake Matthews  vs. James Vick ,L/W
Hatsu Hioki  vs. Dan Hooker ,L/W
Kyle Noke  vs. Jonavin Webb ,W/L
Daniel Kelly  vs. Sam Alvey ,L/W
Bec Rawlings  vs. Lisa Ellis ,W/L
Dylan Andrews  vs. Brad Scott ,L/W
Alex Chambers  vs. Kailin Curran ,W/L
Vik Grujic  vs. Brendan O'Reilly ,L/W
Alptekin Ozkilic  vs. Ben Nguyen ,L/W
Demetrious Johnson  vs. Kyoji Horiguchi ,W/L
Quinton Jackson  vs. Fabio Maldonado ,W/L
Michael Bisping  vs. CB Dollaway ,W/L
John Makdessi  vs. Shane Campbell ,W/L
Yves Jabouin  vs. Thomas Almeida ,L/W
Patrick Cote  vs. Joe Riggs ,W/L
Alexis Davis  vs. Sarah Kaufman ,W/L
Chad Laprise  vs. Bryan Barberena ,W/L
Olivier Aubin-Mercier  vs. David Michaud ,W/L
Nordine Taleb  vs. Chris Clements ,W/L
Jessica Rakoczy  vs. Valerie Letourneau ,L/W
Randa Markos  vs. Aisling Daly ,W/L
Lyoto Machida  vs. Luke Rockhold ,L/W
Jacare Souza  vs. Chris Camozzi ,W/L
Cub Swanson  vs. Max Holloway ,L/W
Felice Herrig  vs. Paige VanZant ,L/W
Jim Miller  vs. Beneil Dariush ,L/W
Ovince Saint Preux  vs. Patrick Cummins ,W/L
Corey Anderson  vs. Gian Villante ,L/W
Takeya Mizugaki  vs. Aljamain Sterling ,L/W
George Sullivan  vs. Tim Means ,L/W
Diego Brandao  vs. Jimy Hettes ,W/L
Eddie Gordon  vs. Chris Dempsey ,L/W
Gabriel Gonzaga  vs. Mirko Filipovic ,L/W
Jimi Manuwa  vs. Jan Blachowicz ,W/L
Pawel Pawlak  vs. Sheldon Westcott ,W/L
Joanne Wood  vs. Maryna Moroz ,L/W
Seth Baczynski  vs. Leon Edwards ,L/W
Bartosz Fabinski  vs. Garreth McLellan ,W/L
Sergio Moraes  vs. Mickael Lebout ,W/L
Damian Stasiak  vs. Yaotzin Meza ,L/W
Daniel Omielanczuk  vs. Anthony Hamilton ,L/W
Izabela Badurek  vs. Aleksandra Albu ,L/W
Marcin Bandel  vs. Stevie Ray ,L/W
Taylor Lapilus  vs. Rocky Lee ,W/L
Chad Mendes  vs. Ricardo Lamas ,W/L
Jorge Masvidal  vs. Al Iaquinta ,L/W
Michael Chiesa  vs. Mitch Clarke ,W/L
Julianna Pena  vs. Milana Dudieva ,W/L
Clay Guida  vs. Robert Peralta ,W/L
Dustin Poirier  vs. Diego Ferreira ,W/L
Liz Carmouche  vs. Lauren Murphy ,W/L
Gray Maynard  vs. Alexander Yakovlev ,L/W
Shamil Abdurakhimov  vs. Timothy Johnson ,L/W
Ron Stallings  vs. Justin Jones ,W/L
Demian Maia  vs. Ryan LaFlare ,W/L
Erick Silva  vs. Josh Koscheck ,W/L
Leonardo Santos  vs. Anthony Rocco Martin ,W/L
Amanda Nunes  vs. Shayna Baszler ,W/L
Gilbert Burns  vs. Alex Oliveira ,W/L
Godofredo Pepey  vs. Andre Fili ,W/L
Francisco Trinaldo  vs. Akbarh Arreola ,W/L
Edimilson Souza  vs. Katsunori Kikuno ,W/L
Leandro Silva  vs. Drew Dober ,NC/NC
Leonardo Mafra  vs. Cain Carrizosa ,W/L
Jorge de Oliveira  vs. Christos Giagos ,L/W
Bentley Syler  vs. Fredy Serrano ,L/W
Anthony Pettis  vs. Rafael Dos Anjos ,L/W
Carla Esparza  vs. Joanna Jedrzejczyk ,L/W
Johny Hendricks  vs. Matt Brown ,W/L
Roy Nelson  vs. Alistair Overeem ,L/W
Chris Cariaso  vs. Henry Cejudo ,L/W
Ross Pearson  vs. Sam Stout ,W/L
Elias Theodorou  vs. Roger Narvaez ,W/L
Daron Cruickshank  vs. Beneil Dariush ,L/W
Jared Rosholt  vs. Josh Copeland ,W/L
Sergio Pettis  vs. Ryan Benoit ,L/W
Jake Lindsey  vs. Joe Duffy ,L/W
Larissa Pacheco  vs. Germaine de Randamie ,L/W
Ronda Rousey  vs. Cat Zingano ,W/L
Raquel Pennington  vs. Holly Holm ,L/W
Jake Ellenberger  vs. Josh Koscheck ,W/L
Alan Jouban  vs. Richard Walsh ,W/L
Tony Ferguson  vs. Gleison Tibau ,W/L
Mark Munoz  vs. Roan Carneiro ,L/W
Roman Salazar  vs. Norifumi Yamamoto ,NC/NC
Dhiego Lima  vs. Tim Means ,L/W
Derrick Lewis  vs. Ruan Potts ,W/L
James Krause  vs. Valmir Lazaro ,L/W
Masio Fullen  vs. Alex Torres ,W/L
Antonio Silva  vs. Frank Mir ,L/W
Edson Barboza  vs. Michael Johnson ,L/W
Cezar Ferreira  vs. Sam Alvey ,L/W
Rustam Khabilov  vs. Adriano Martins ,L/W
Iuri Alcantara  vs. Frankie Saenz ,L/W
Santiago Ponzinibbio  vs. Sean Strickland ,W/L
Jessica Andrade  vs. Marion Reneau ,L/W
William Macario  vs. Matt Dwyer ,L/W
Tiago dos Santos e Silva  vs. Mike de la Torre ,L/W
Douglas Silva de Andrade  vs. Cody Gibson ,W/L
Ivan Jorge  vs. Josh Shockley ,W/L
Benson Henderson  vs. Brandon Thatch ,W/L
Max Holloway  vs. Cole Miller ,W/L
Neil Magny  vs. Kiichi Kunimoto ,W/L
Daniel Kelly  vs. Patrick Walsh ,W/L
Michel Prazeres  vs. Kevin Lee ,L/W
Ray Borg  vs. Chris Kelades ,W/L
Efrain Escudero  vs. Rodrigo de Lima ,W/L
Chas Skelly  vs. Jim Alers ,W/L
Zach Makovsky  vs. Tim Elliott ,W/L
James Moontasri  vs. Cody Pfister ,W/L
Anderson Silva  vs. Nick Diaz ,NC/NC
Tyron Woodley  vs. Kelvin Gastelum ,W/L
Joe Lauzon  vs. Al Iaquinta ,L/W
Thales Leites  vs. Tim Boetsch ,W/L
Jordan Mein  vs. Thiago Alves ,L/W
Miesha Tate  vs. Sara McMann ,W/L
Ed Herman  vs. Derek Brunson ,L/W
Ian McCall  vs. John Lineker ,L/W
Rafael Natal  vs. Tom Watson ,W/L
Richardson Moreira  vs. Ildemar Alcantara ,L/W
Thiago Santos  vs. Andy Enz ,W/L
Alexander Gustafsson  vs. Anthony Johnson ,L/W
Dan Henderson  vs. Gegard Mousasi ,L/W
Phil Davis  vs. Ryan Bader ,L/W
Akira Corassani  vs. Sam Sicilia ,L/W
Nicholas Musoke  vs. Albert Tumenov ,L/W
Kenny Robertson  vs. Sultan Aliev ,W/L
Andy Ogle  vs. Makwan Amirkhani ,L/W
Nikita Krylov  vs. Stanislav Nedkov ,W/L
Mairbek Taisumov  vs. Anthony Christodoulou ,W/L
Mirsad Bektic  vs. Paul Redmond ,W/L
Viktor Pesta  vs. Konstantin Erokhin ,W/L
Neil Seery  vs. Chris Beal ,W/L
Conor McGregor  vs. Dennis Siver ,W/L
Donald Cerrone  vs. Benson Henderson ,W/L
Uriah Hall  vs. Ron Stallings ,W/L
Norman Parke  vs. Gleison Tibau ,L/W
Cathal Pendred  vs. Sean Spencer ,W/L
John Howard  vs. Lorenz Larkin ,L/W
