Fight,OUTCOME
Derrick Lewis  vs. Rodrigo Nascimento ,W/L
Joaquin Buckley  vs. Nursulton Ruziboev ,W/L
Alonzo Menifield  vs. Carlos Ulberg ,L/W
Diego Ferreira  vs. Mateusz Rebecki ,W/L
Alex Caceres  vs. Sean Woodson ,L/W
Waldo Cortes-Acosta  vs. Robelis Despaigne ,W/L
Chase Hooper  vs. Viacheslav Borshchev ,W/L
Terrance McKinney  vs. Esteban Ribovics ,L/W
Tabatha Ricci  vs. Tecia Pennington ,W/L
Billy Ray Goff  vs. Trey Waters ,L/W
Charles Johnson  vs. Jake Hadley ,W/L
JJ Aldrich  vs. Veronica Hardy ,L/W
Alexandre Pantoja  vs. Steve Erceg ,W/L
Jose Aldo  vs. Jonathan Martinez ,W/L
Anthony Smith  vs. Vitor Petrino ,W/L
Michel Pereira  vs. Ihor Potieria ,W/L
Paul Craig  vs. Caio Borralho ,L/W
Jack Shore  vs. Joanderson Brito ,L/W
Karolina Kowalkiewicz  vs. Iasmin Lucindo ,L/W
Elves Brener  vs. Myktybek Orolbai ,L/W
Joaquim Silva  vs. Drakkar Klose ,L/W
Mauricio Ruffy  vs. Jamie Mullarkey ,W/L
Dione Barbosa  vs. Ernesta Kareckaite ,W/L
Ismael Bonfim  vs. Vinc Pichel ,W/L
Alessandro Costa  vs. Kevin Borjas ,W/L
Matheus Nicolau  vs. Alex Perez ,L/W
Ryan Spann  vs. Bogdan Guskov ,L/W
Ariane da Silva  vs. Karine Silva ,L/W
Austen Lane  vs. Jhonata Diniz ,L/W
Jonathan Pearce  vs. David Onama ,L/W
Tim Means  vs. Uros Medic ,L/W
Rani Yahya  vs. Victor Henry ,L/W
Austin Hubbard  vs. Michal Figlak ,W/L
Don'Tale Mayes  vs. Caio Machado ,W/L
Marnic Mann  vs. Ketlen Souza ,L/W
James Llontop  vs. Chris Padilla ,L/W
Ivana Petrovic  vs. Liang Na ,W/L
Gabriel Benitez  vs.  Maheshate ,L/W
Alex Pereira  vs. Jamahal Hill ,W/L
Zhang Weili  vs. Yan Xiaonan ,W/L
Justin Gaethje  vs. Max Holloway ,L/W
Charles Oliveira  vs. Arman Tsarukyan ,L/W
Bo Nickal  vs. Cody Brundage ,W/L
Jiri Prochazka  vs. Aleksandar Rakic ,W/L
Calvin Kattar  vs. Aljamain Sterling ,L/W
Holly Holm  vs. Kayla Harrison ,L/W
Sodiq Yusuff  vs. Diego Lopes ,L/W
Jalin Turner  vs. Renato Moicano ,L/W
Jessica Andrade  vs. Marina Rodriguez ,W/L
Bobby Green  vs. Jim Miller ,W/L
Deiveson Figueiredo  vs. Cody Garbrandt ,W/L
Brendan Allen  vs. Chris Curtis ,W/L
Alexander Hernandez  vs. Damon Jackson ,L/W
Morgan Charriere  vs. Chepe Mariscal ,L/W
Ignacio Bahamondes  vs. Christos Giagos ,W/L
Trevor Peek  vs. Charlie Campbell ,L/W
Court McGee  vs. Alex Morono ,L/W
Valter Walker  vs. Lukasz Brzeski ,L/W
Norma Dumont  vs. Germaine de Randamie ,W/L
Pedro Falcao  vs. Victor Hugo ,L/W
Dan Argueta  vs. Jean Matsumoto ,L/W
Dylan Budka  vs. Cesar Almeida ,L/W
Melissa Mullins  vs. Nora Cornolle ,L/W
Erin Blanchfield  vs. Manon Fiorot ,L/W
Vicente Luque  vs. Joaquin Buckley ,L/W
Chris Weidman  vs. Bruno Silva ,W/L
Nursulton Ruziboev  vs. Sedriques Dumas ,W/L
Bill Algeo  vs. Kyle Nelson ,L/W
Chidi Njokuani  vs. Rhys McKee ,W/L
Nate Landwehr  vs. Jamall Emmers ,W/L
Virna Jandiroba  vs. Loopy Godinez ,W/L
Julio Arce  vs. Herbert Burns ,W/L
Dennis Buzukja  vs. Connor Matthews ,W/L
Ibo Aslan  vs. Anton Turkalj ,W/L
Andre Petroski  vs. Jacob Malkoun ,L/W
Angel Pacheco  vs. Caolan Loughran ,L/W
Amanda Ribas  vs. Rose Namajunas ,L/W
Karl Williams  vs. Justin Tafa ,W/L
Edmen Shahbazyan  vs. AJ Dobson ,W/L
Payton Talbott  vs. Cameron Saaiman ,W/L
Billy Quarantillo  vs. Youssef Zalal ,L/W
Fernando Padilla  vs. Luis Pajuelo ,W/L
Kurt Holobaugh  vs. Trey Ogden ,L/W
Ricardo Ramos  vs. Julian Erosa ,L/W
Miles Johns  vs. Cody Gibson ,W/L
Jarno Errens  vs. Steven Nguyen ,W/L
Montserrat Rendon  vs. Daria Zhelezniakova ,L/W
Igor Severino  vs. Andre Lima ,L/W
Mohammed Usman  vs. Mick Parkin ,L/W
Tai Tuivasa  vs. Marcin Tybura ,L/W
Bryan Battle  vs. Ange Loosa ,NC/NC
Ovince Saint Preux  vs. Kennedy Nzechukwu ,W/L
Christian Rodriguez  vs. Isaac Dulgarian ,W/L
Pannie Kianzad  vs. Macy Chiasson ,L/W
Gerald Meerschaert  vs. Bryan Barberena ,W/L
Natan Levy  vs. Mike Davis ,L/W
Josiane Nunes  vs. Chelsea Chandler ,L/W
Jafel Filho  vs. Ode Osbourne ,W/L
Josh Culibao  vs. Danny Silva ,L/W
Jaqueline Amorim  vs. Cory McKenna ,W/L
Thiago Moises  vs. Mitch Ramirez ,W/L
Charalampos Grigoriou  vs. Chad Anheliger ,L/W
Sean O'Malley  vs. Marlon Vera ,W/L
Dustin Poirier  vs. Benoit Saint Denis ,W/L
Kevin Holland  vs. Michael Page ,L/W
Gilbert Burns  vs. Jack Della Maddalena ,L/W
Petr Yan  vs. Song Yadong ,W/L
Curtis Blaydes  vs. Jailton Almeida ,W/L
Katlyn Cerminara  vs. Maycee Barber ,L/W
Mateusz Gamrot  vs. Rafael Dos Anjos ,W/L
Pedro Munhoz  vs. Kyler Phillips ,L/W
Ion Cutelaba  vs. Philipe Lins ,L/W
Michel Pereira  vs. Michal Oleksiejczuk ,W/L
Robelis Despaigne  vs. Josh Parisian ,W/L
CJ Vergara  vs. Asu Almabayev ,L/W
Joanne Wood  vs. Maryna Moroz ,W/L
Jairzinho Rozenstruik  vs. Shamil Gaziev ,W/L
Vitor Petrino  vs. Tyson Pedro ,W/L
Alex Perez  vs. Muhammad Mokaev ,L/W
Umar Nurmagomedov  vs. Bekzat Almakhan ,W/L
Matt Schnell  vs. Steve Erceg ,L/W
Eryk Anders  vs. Jamie Pickett ,W/L
Vinicius Oliveira  vs. Benardo Sopaj ,W/L
Aiemann Zahabi  vs. Javid Basharat ,W/L
Christian Leroy Duncan  vs. Claudio Ribeiro ,W/L
Ludovit Klein  vs. AJ Cunningham ,W/L
Abdul-Kareem Al-Selwady  vs. Loik Radzhabov ,L/W
Brandon Moreno  vs. Brandon Royval ,L/W
Yair Rodriguez  vs. Brian Ortega ,L/W
Daniel Zellhuber  vs. Francisco Prado ,W/L
Yazmin Jauregui  vs. Sam Hughes ,W/L
Manuel Torres  vs. Chris Duncan ,W/L
Cristian Quinonez  vs. Raoni Barcelos ,L/W
Jesus Aguilar  vs. Mateus Mendonca ,W/L
Edgar Chairez  vs. Daniel Lacerda ,W/L
Claudio Puelles  vs. Fares Ziam ,L/W
Ronaldo Rodriguez  vs. Denys Bondar ,W/L
Victor Altamirano  vs. Felipe dos Santos ,L/W
Erik Silva  vs. Muhammad Naimov ,L/W
Alexander Volkanovski  vs. Ilia Topuria ,L/W
Robert Whittaker  vs. Paulo Costa ,W/L
Geoff Neal  vs. Ian Machado Garry ,L/W
Merab Dvalishvili  vs. Henry Cejudo ,W/L
Anthony Hernandez  vs. Roman Kopylov ,W/L
Amanda Lemos  vs. Mackenzie Dern ,W/L
Marcos Rogerio de Lima  vs. Junior Tafa ,W/L
Rinya Nakamura  vs. Carlos Vera ,W/L
Zhang Mingyang  vs. Brendson Ribeiro ,W/L
Josh Quinlan  vs. Danny Barlow ,L/W
Oban Elliott  vs. Val Woodburn ,W/L
Andrea Lee  vs. Miranda Maverick ,L/W
Jack Hermansson  vs. Joe Pyfer ,W/L
Dan Ige  vs. Andre Fili ,W/L
Robert Bryczek  vs. Ihor Potieria ,L/W
Brad Tavares  vs. Gregory Rodrigues ,L/W
Michael Johnson  vs. Darrius Flowers ,W/L
Rodolfo Vieira  vs. Armen Petrosyan ,W/L
Trevin Giles  vs. Carlos Prates ,L/W
Bolaji Oki  vs. Timmy Cuamba ,W/L
Loma Lookboonmee  vs. Bruna Brasil ,W/L
Devin Clark  vs. Marcin Prachnio ,L/W
Max Griffin  vs. Jeremiah Wells ,W/L
Zac Pauga  vs. Bogdan Guskov ,L/W
Fernie Garcia  vs. Hyder Amil ,L/W
Daniel Marcos  vs.  Aoriqileng ,NC/NC
Roman Dolidze  vs. Nassourdine Imavov ,L/W
Renato Moicano  vs. Drew Dober ,W/L
Randy Brown  vs. Muslim Salikhov ,W/L
Viviane Araujo  vs. Natalia Silva ,L/W
Aliaskhab Khizriev  vs. Makhmud Muradov ,NC/NC
Gilbert Urbina  vs. Charles Radtke ,L/W
Molly McCann  vs. Diana Belbita ,W/L
Azat Maksum  vs. Charles Johnson ,L/W
Themba Gorimbo  vs. Pete Rodriguez ,W/L
JeongYeong Lee  vs. Blake Bilder ,W/L
Luana Carolina  vs. Julija Stoliarenko ,W/L
Landon Quinones  vs. MarQuel Mederos ,L/W
Thomas Petersen  vs. Jamal Pogues ,L/W
Sean Strickland  vs. Dricus Du Plessis ,L/W
Raquel Pennington  vs. Mayra Bueno Silva ,W/L
Neil Magny  vs. Mike Malott ,W/L
Chris Curtis  vs. Marc-Andre Barriault ,W/L
Arnold Allen  vs. Movsar Evloev ,L/W
Brad Katona  vs. Garrett Armfield ,L/W
Charles Jourdain  vs. Sean Woodson ,L/W
Serhiy Sidey  vs. Ramon Taveras ,L/W
Gillian Robertson  vs. Polyana Viana ,W/L
Yohan Lainesse  vs. Sam Patterson ,L/W
Jasmine Jasudavicius  vs. Priscila Cachoeira ,W/L
Malcolm Gordon  vs. Jimmy Flick ,L/W
Magomed Ankalaev  vs. Johnny Walker ,W/L
Jim Miller  vs. Gabriel Benitez ,W/L
Ricky Simon  vs. Mario Bautista ,L/W
Phil Hawes  vs. Brunno Ferreira ,L/W
Andrei Arlovski  vs. Waldo Cortes-Acosta ,L/W
Matthew Semelsberger  vs. Preston Parsons ,L/W
Marcus McGhee  vs. Gaston Bolanos ,W/L
Farid Basharat  vs. Taylor Lapilus ,W/L
Westin Wilson  vs. Jean Silva ,L/W
Nikolas Motta  vs. Tom Nolan ,W/L
Joshua Van  vs. Felipe Bunes ,W/L
Leon Edwards  vs. Colby Covington ,W/L
Alexandre Pantoja  vs. Brandon Royval ,W/L
Shavkat Rakhmonov  vs. Stephen Thompson ,W/L
Tony Ferguson  vs. Paddy Pimblett ,L/W
Josh Emmett  vs. Bryce Mitchell ,W/L
Alonzo Menifield  vs. Dustin Jacoby ,W/L
Irene Aldana  vs. Karol Rosa ,W/L
Cody Garbrandt  vs. Brian Kelleher ,W/L
Casey O'Neill  vs. Ariane Lipski ,L/W
Tagir Ulanbekov  vs. Cody Durden ,W/L
Andre Fili  vs. Lucas Almeida ,W/L
Martin Buday  vs. Shamil Gaziev ,L/W
Song Yadong  vs. Chris Gutierrez ,W/L
Anthony Smith  vs. Khalil Rountree Jr. ,L/W
Nasrat Haqparast  vs. Jamie Mullarkey ,W/L
Tim Elliott  vs.  Sumudaerji ,W/L
JunYong Park  vs. Andre Muniz ,L/W
Song Kenan  vs. Kevin Jousset ,L/W
HyunSung Park  vs. Shannon Ross ,W/L
Steve Garcia  vs. Melquizael Costa ,W/L
Luana Santos  vs. Stephanie Egger ,W/L
Tatsuro Taira  vs. Carlos Hernandez ,W/L
Rayanne Amanda  vs. Talita Alencar ,L/W
Beneil Dariush  vs. Arman Tsarukyan ,L/W
Jalin Turner  vs. Bobby Green ,W/L
Rob Font  vs. Deiveson Figueiredo ,L/W
Sean Brady  vs. Kelvin Gastelum ,W/L
Clay Guida  vs. Joaquim Silva ,L/W
Punahele Soriano  vs. Dustin Stoltzfus ,L/W
Miesha Tate  vs. Julia Avila ,W/L
Zach Reese  vs. Cody Brundage ,L/W
Drakkar Klose  vs. Joe Solecki ,W/L
Rodolfo Bellato  vs. Ihor Potieria ,W/L
Wellington Turman  vs. Jared Gooden ,L/W
Veronica Hardy  vs. Jamey-Lyn Horth ,W/L
Brendan Allen  vs. Paul Craig ,W/L
Michael Morales  vs. Jake Matthews ,W/L
Chase Hooper  vs. Jordan Leavitt ,W/L
Payton Talbott  vs. Nick Aguirre ,W/L
Luana Pinheiro  vs. Amanda Ribas ,L/W
Uros Medic  vs. Myktybek Orolbai ,L/W
Jonathan Pearce  vs. Joanderson Brito ,L/W
Chad Anheliger  vs. Jose Johnson ,L/W
Christian Leroy Duncan  vs. Denis Tiuliulin ,W/L
Mick Parkin  vs. Caio Machado ,W/L
Jeka Saragih  vs. Lucas Alexander ,W/L
Lucie Pudilova  vs. Ailin Perez ,L/W
Trey Ogden  vs. Nikolas Motta ,NC/NC
Charles Johnson  vs. Rafael Estevam ,L/W
Jiri Prochazka  vs. Alex Pereira ,L/W
Sergei Pavlovich  vs. Tom Aspinall ,L/W
Jessica Andrade  vs. Mackenzie Dern ,W/L
Matt Frevola  vs. Benoit Saint Denis ,L/W
Diego Lopes  vs. Pat Sabatini ,W/L
Steve Erceg  vs. Alessandro Costa ,W/L
Tabatha Ricci  vs. Loopy Godinez ,L/W
Mateusz Rebecki  vs. Roosevelt Roberts ,W/L
Nazim Sadykhov  vs. Viacheslav Borshchev ,D/D
Jared Gordon  vs. Mark Madsen ,W/L
John Castaneda  vs. Kyung Ho Kang ,W/L
Joshua Van  vs. Kevin Borjas ,W/L
Dennis Buzukja  vs. Jamall Emmers ,L/W
Jailton Almeida  vs. Derrick Lewis ,W/L
Gabriel Bonfim  vs. Nicolas Dalby ,L/W
Rodrigo Nascimento  vs. Don'Tale Mayes ,W/L
Caio Borralho  vs. Abus Magomedov ,W/L
Elves Brener  vs. Kaynan Kruschewsky ,W/L
Rinat Fakhretdinov  vs. Elizeu Zaleski dos Santos ,D/D
Vitor Petrino  vs. Modestas Bukauskas ,W/L
Angela Hill  vs. Denise Gomes ,W/L
Eduarda Moura  vs. Montserrat Conejo Ruiz ,W/L
Kaue Fernandes  vs. Marc Diakiese ,L/W
Sodiq Yusuff  vs. Edson Barboza ,L/W
Jennifer Maia  vs. Viviane Araujo ,L/W
Jonathan Martinez  vs. Adrian Yanez ,W/L
Andre Petroski  vs. Michel Pereira ,L/W
Christian Rodriguez  vs. Cameron Saaiman ,W/L
Darren Elkins  vs. TJ Brown ,W/L
Tainara Lisboa  vs. Ravena Oliveira ,W/L
Terrance McKinney  vs. Brendon Marotte ,W/L
Irina Alekseeva  vs. Melissa Dixon ,L/W
Chris Gutierrez  vs.  Alatengheili ,W/L
Ashley Yoder  vs. Emily Ducote ,L/W
Grant Dawson  vs. Bobby Green ,L/W
Joe Pyfer  vs. Abdul Razak Alhassan ,W/L
Alex Morono  vs. Joaquin Buckley ,L/W
Drew Dober  vs. Ricky Glenn ,W/L
Alexander Hernandez  vs. Bill Algeo ,L/W
Karolina Kowalkiewicz  vs. Diana Belbita ,W/L
Nate Maness  vs. Mateus Mendonca ,W/L
Vanessa Demopoulos  vs. Kanako Murata ,W/L
 Aoriqileng  vs. Johnny Munoz ,W/L
Montana De La Rosa  vs. JJ Aldrich ,L/W
Rafael Fiziev  vs. Mateusz Gamrot ,L/W
Bryce Mitchell  vs. Dan Ige ,W/L
Marina Rodriguez  vs. Michelle Waterson-Gomez ,W/L
Bryan Battle  vs. AJ Fletcher ,W/L
Ricardo Ramos  vs. Charles Jourdain ,L/W
Dan Argueta  vs. Miles Johns ,L/W
Tim Means  vs. Andre Fialho ,W/L
Jacob Malkoun  vs. Cody Brundage ,L/W
Mohammed Usman  vs. Jake Collier ,W/L
Mizuki vs. Hannah Goldy ,W/L
Tamires Vidal  vs. Montserrat Rendon ,L/W
Alexa Grasso  vs. Valentina Shevchenko ,D/D
Kevin Holland  vs. Jack Della Maddalena ,L/W
Raul Rosas Jr.  vs. Terrence Mitchell ,W/L
Daniel Zellhuber  vs. Christos Giagos ,W/L
Fernando Padilla  vs. Kyle Nelson ,L/W
Loopy Godinez  vs. Elise Reed ,W/L
Roman Kopylov  vs. Josh Fremd ,W/L
Edgar Chairez  vs. Daniel Lacerda ,NC/NC
Tracy Cortez  vs. Jasmine Jasudavicius ,W/L
Alex Reyes  vs. Charlie Campbell ,L/W
Josefine Knutsson  vs. Marnic Mann ,W/L
Israel Adesanya  vs. Sean Strickland ,L/W
Tai Tuivasa  vs. Alexander Volkov ,L/W
Manel Kape  vs. Felipe dos Santos ,W/L
Justin Tafa  vs. Austen Lane ,W/L
Tyson Pedro  vs. Anton Turkalj ,W/L
Carlos Ulberg  vs. Da Woon Jung ,W/L
Jack Jenkins  vs. Chepe Mariscal ,L/W
Jamie Mullarkey  vs. John Makdessi ,W/L
Nasrat Haqparast  vs. Landon Quinones ,W/L
Blood Diamond  vs. Charles Radtke ,L/W
Shane Young  vs. Gabriel Miranda ,L/W
Kevin Jousset  vs. Kiefer Crosbie ,W/L
Ciryl Gane  vs. Serghei Spivac ,W/L
Manon Fiorot  vs. Rose Namajunas ,W/L
Benoit Saint Denis  vs. Thiago Moises ,W/L
Volkan Oezdemir  vs. Bogdan Guskov ,W/L
William Gomis  vs. Yanis Ghemmouri ,W/L
Morgan Charriere  vs. Manolo Zecchini ,W/L
Taylor Lapilus  vs. Caolan Loughran ,W/L
Ange Loosa  vs. Rhys McKee ,W/L
Nora Cornolle  vs. Joselyne Edwards ,W/L
Farid Basharat  vs. Kleydson Rodrigues ,W/L
Zarah Fairn  vs. Jacqueline Cavalcanti ,L/W
Aljamain Sterling  vs. Sean O'Malley ,L/W
Zhang Weili  vs. Amanda Lemos ,W/L
Neil Magny  vs. Ian Garry ,L/W
Da'Mon Blackshear  vs. Mario Bautista ,L/W
Marlon Vera  vs. Pedro Munhoz ,W/L
Chris Weidman  vs. Brad Tavares ,L/W
Gregory Rodrigues  vs. Denis Tiuliulin ,W/L
Kurt Holobaugh  vs. Austin Hubbard ,W/L
Brad Katona  vs. Cody Gibson ,W/L
Andre Petroski  vs. Gerald Meerschaert ,W/L
Andrea Lee  vs. Natalia Silva ,L/W
Karine Silva  vs. Maryna Moroz ,W/L
Vicente Luque  vs. Rafael Dos Anjos ,W/L
Cub Swanson  vs. Hakeem Dawodu ,W/L
Khalil Rountree Jr.  vs. Chris Daukaus ,W/L
Polyana Viana  vs. Iasmin Lucindo ,L/W
AJ Dobson  vs. Tafon Nchukwi ,W/L
Josh Fremd  vs. Jamie Pickett ,W/L
JP Buys  vs. Marcus McGhee ,L/W
Terrance McKinney  vs. Mike Breeden ,W/L
Francis Marshall  vs. Isaac Dulgarian ,L/W
Josh Parisian  vs. Martin Buday ,L/W
Jaqueline Amorim  vs. Montserrat Conejo Ruiz ,W/L
Da'Mon Blackshear  vs. Jose Johnson ,W/L
Juliana Miller  vs. Luana Santos ,L/W
Cory Sandhagen  vs. Rob Font ,W/L
Jessica Andrade  vs. Tatiana Suarez ,L/W
Dustin Jacoby  vs. Kennedy Nzechukwu ,W/L
Diego Lopes  vs. Gavin Tucker ,W/L
Tanner Boser  vs. Aleksa Camur ,W/L
Ignacio Bahamondes  vs. Ludovit Klein ,L/W
Kyler Phillips  vs. Raoni Barcelos ,W/L
Jeremiah Wells  vs. Carlston Harris ,L/W
Billy Quarantillo  vs. Damon Jackson ,W/L
Cody Durden  vs. Jake Hadley ,W/L
Sean Woodson  vs. Dennis Buzukja ,W/L
Ode Osbourne  vs. Assu Almabayev ,L/W
Dustin Poirier  vs. Justin Gaethje ,L/W
Jan Blachowicz  vs. Alex Pereira ,L/W
Derrick Lewis  vs. Marcos Rogerio de Lima ,W/L
Tony Ferguson  vs. Bobby Green ,L/W
Michael Chiesa  vs. Kevin Holland ,L/W
Gabriel Bonfim  vs. Trevin Giles ,W/L
CJ Vergara  vs. Vinicius Salvador ,W/L
Roman Kopylov  vs. Claudio Ribeiro ,W/L
Jake Matthews  vs. Darrius Flowers ,W/L
Matthew Semelsberger  vs. Uros Medic ,L/W
Miranda Maverick  vs. Priscila Cachoeira ,W/L
Tom Aspinall  vs. Marcin Tybura ,W/L
Molly McCann  vs. Julija Stoliarenko ,L/W
Nathaniel Wood  vs. Andre Fili ,W/L
Paul Craig  vs. Andre Muniz ,W/L
Jai Herbert  vs. Fares Ziam ,L/W
Lerone Murphy  vs. Josh Culibao ,W/L
Davey Grant  vs. Daniel Marcos ,L/W
Danny Roberts  vs. Jonny Parsons ,L/W
Marc Diakiese  vs. Joel Alvarez ,L/W
Mick Parkin  vs. Jamal Pogues ,W/L
Makhmud Muradov  vs. Bryan Barberena ,W/L
Ketlen Vieira  vs. Pannie Kianzad ,W/L
Chris Duncan  vs. Yanal Ashmouz ,W/L
Shauna Bannon  vs. Bruna Brasil ,L/W
Jafel Filho  vs. Daniel Barez ,W/L
Holly Holm  vs. Mayra Bueno Silva ,L/W
Jack Della Maddalena  vs. Bassil Hafez ,W/L
Ottman Azaitar  vs. Francisco Prado ,L/W
Albert Duraev  vs. JunYong Park ,L/W
Norma Dumont  vs. Chelsea Chandler ,W/L
Nazim Sadykhov  vs. Terrance McKinney ,W/L
Tucker Lutz  vs. Melsik Baghdasaryan ,L/W
Viktoriia Dudakova  vs. Istela Nunes ,W/L
Austin Lingo  vs. Melquizael Costa ,L/W
Evan Elder  vs. Genaro Valdez ,W/L
Tyson Nam  vs. Azat Maksum ,L/W
Alexander Munoz  vs. Carl Deaton ,W/L
Ashlee Evans-Smith  vs. Ailin Perez ,L/W
Alexander Volkanovski  vs. Yair Rodriguez ,W/L
Brandon Moreno  vs. Alexandre Pantoja ,L/W
Robert Whittaker  vs. Dricus Du Plessis ,L/W
Jalin Turner  vs. Dan Hooker ,L/W
Bo Nickal  vs. Val Woodburn ,W/L
Robbie Lawler  vs. Niko Price ,W/L
Tatsuro Taira  vs. Edgar Chairez ,W/L
Yazmin Jauregui  vs. Denise Gomes ,L/W
Jimmy Crute  vs. Alonzo Menifield ,L/W
Vitor Petrino  vs. Marcin Prachnio ,W/L
Cameron Saaiman  vs. Terrence Mitchell ,W/L
Shannon Ross  vs. Jesus Aguilar ,L/W
Kamuela Kirk  vs. Esteban Ribovics ,L/W
Sean Strickland  vs. Abus Magomedov ,W/L
Damir Ismagulov  vs. Grant Dawson ,L/W
Max Griffin  vs. Michael Morales ,L/W
Ariane Lipski  vs. Melissa Gatto ,W/L
Ismael Bonfim  vs. Benoit Saint Denis ,L/W
Brunno Ferreira  vs. Nursulton Ruziboev ,L/W
Kevin Lee  vs. Rinat Fakhretdinov ,L/W
Joanderson Brito  vs. Westin Wilson ,W/L
Yana Santos  vs. Karol Rosa ,L/W
Guram Kutateladze  vs. Elves Brener ,L/W
Ivana Petrovic  vs. Luana Carolina ,L/W
Alexandr Romanov  vs. Blagoy Ivanov ,W/L
Josh Emmett  vs. Ilia Topuria ,L/W
Amanda Ribas  vs. Maycee Barber ,L/W
Austen Lane  vs. Justin Tafa ,NC/NC
David Onama  vs. Gabriel Santos ,W/L
Brendan Allen  vs. Bruno Silva ,W/L
Neil Magny  vs. Phil Rowe ,W/L
Randy Brown  vs. Wellington Turman ,W/L
Mateusz Rebecki  vs. Loik Radzhabov ,W/L
Tabatha Ricci  vs. Gillian Robertson ,W/L
Zhalgas Zhumagulov  vs. Joshua Van ,L/W
Trevor Peek  vs. Chepe Mariscal ,L/W
Jamall Emmers  vs. Jack Jenkins ,L/W
Cody Brundage  vs. Sedriques Dumas ,L/W
Marvin Vettori  vs. Jared Cannonier ,L/W
Arman Tsarukyan  vs. Joaquim Silva ,W/L
Armen Petrosyan  vs. Christian Leroy Duncan ,W/L
Pat Sabatini  vs. Lucas Almeida ,W/L
Manuel Torres  vs. Nikolas Motta ,W/L
Nicolas Dalby  vs. Muslim Salikhov ,W/L
Jimmy Flick  vs. Alessandro Costa ,L/W
Kyung Ho Kang  vs. Cristian Quinonez ,W/L
Carlos Hernandez  vs. Denys Bondar ,W/L
Tereza Bleda  vs. Gabriella Fernandes ,W/L
Dan Argueta  vs. Ronnie Lawrence ,NC/NC
Zac Pauga  vs. Modestas Bukauskas ,L/W
Amanda Nunes  vs. Irene Aldana ,W/L
Charles Oliveira  vs. Beneil Dariush ,W/L
Mike Malott  vs. Adam Fugitt ,W/L
Dan Ige  vs. Nate Landwehr ,W/L
Marc-Andre Barriault  vs. Eryk Anders ,W/L
Nassourdine Imavov  vs. Chris Curtis ,NC/NC
Miranda Maverick  vs. Jasmine Jasudavicius ,L/W
Aiemann Zahabi  vs.  Aoriqileng ,W/L
Kyle Nelson  vs. Blake Bilder ,W/L
David Dvorak  vs. Steve Erceg ,L/W
Diana Belbita  vs. Maria Oliveira ,W/L
Kai Kara-France  vs. Amir Albazi ,L/W
Alex Caceres  vs. Daniel Pineda ,W/L
Jim Miller  vs. Jesse Butler ,W/L
Tim Elliott  vs. Victor Altamirano ,W/L
Karine Silva  vs. Ketlen Souza ,W/L
Abubakar Nurmagomedov  vs. Elizeu Zaleski dos Santos ,L/W
Daniel Santos  vs. Johnny Munoz ,W/L
Andrei Arlovski  vs. Don'Tale Mayes ,L/W
John Castaneda  vs. Muin Gafurov ,W/L
Jamie Mullarkey  vs. Muhammad Naimov ,L/W
Elise Reed  vs. Jinh Yu Frey ,W/L
Da'Mon Blackshear  vs. Luan Lacerda ,W/L
Philipe Lins  vs. Maxim Grishin ,W/L
Mackenzie Dern  vs. Angela Hill ,W/L
Edmen Shahbazyan  vs. Anthony Hernandez ,L/W
Emily Ducote  vs. Loopy Godinez ,L/W
Andre Fialho  vs. Joaquin Buckley ,L/W
Diego Ferreira  vs. Michael Johnson ,W/L
 Maheshate  vs. Viacheslav Borshchev ,L/W
Karolina Kowalkiewicz  vs. Vanessa Demopoulos ,W/L
Orion Cosce  vs. Gilbert Urbina ,L/W
Ilir Latifi  vs. Rodrigo Nascimento ,L/W
Chase Hooper  vs. Nick Fiore ,W/L
Natalia Silva  vs. Victoria Leonardo ,W/L
Takashi Sato  vs. Themba Gorimbo ,L/W
Jairzinho Rozenstruik  vs. Jailton Almeida ,L/W
Anthony Smith  vs. Johnny Walker ,L/W
Daniel Rodriguez  vs. Ian Garry ,L/W
Carlos Ulberg  vs. Ihor Potieria ,W/L
Tim Means  vs. Alex Morono ,L/W
Matt Brown  vs. Court McGee ,W/L
Karl Williams  vs. Chase Sherman ,W/L
Cody Stamann  vs. Douglas Silva de Andrade ,L/W
Ji Yeon Kim  vs. Mandy Bohm ,L/W
Bryan Battle  vs. Gabe Green ,W/L
Jessica-Rose Clark  vs. Tainara Lisboa ,L/W
Aljamain Sterling  vs. Henry Cejudo ,W/L
Belal Muhammad  vs. Gilbert Burns ,W/L
Jessica Andrade  vs. Yan Xiaonan ,L/W
Movsar Evloev  vs. Diego Lopes ,W/L
Kron Gracie  vs. Charles Jourdain ,L/W
Drew Dober  vs. Matt Frevola ,L/W
Kennedy Nzechukwu  vs. Devin Clark ,W/L
Khaos Williams  vs. Rolando Bedoya ,W/L
Marina Rodriguez  vs. Virna Jandiroba ,L/W
Braxton Smith  vs. Parker Porter ,L/W
Phil Hawes  vs. Ikram Aliskerov ,L/W
Joseph Holmes  vs. Claudio Ribeiro ,L/W
Song Yadong  vs. Ricky Simon ,W/L
Caio Borralho  vs. Michal Oleksiejczuk ,W/L
Rodolfo Vieira  vs. Cody Brundage ,W/L
Julian Erosa  vs. Fernando Padilla ,L/W
Marcos Rogerio de Lima  vs. Waldo Cortes-Acosta ,W/L
Josh Quinlan  vs. Trey Waters ,L/W
Martin Buday  vs. Jake Collier ,W/L
Cody Durden  vs. Charles Johnson ,W/L
Stephanie Egger  vs. Irina Alekseeva ,L/W
Journey Newson  vs. Marcus McGhee ,L/W
Hailey Cowan  vs. Jamey-Lyn Horth ,L/W
Sergei Pavlovich  vs. Curtis Blaydes ,W/L
Brad Tavares  vs. Bruno Silva ,L/W
Bobby Green  vs. Jared Gordon ,NC/NC
Iasmin Lucindo  vs. Brogan Walker ,W/L
Jeremiah Wells  vs. Matthew Semelsberger ,W/L
Ricky Glenn  vs. Christos Giagos ,L/W
Rani Yahya  vs. Montel Jackson ,L/W
Karol Rosa  vs. Norma Dumont ,L/W
Mohammed Usman  vs. Junior Tafa ,W/L
Francis Marshall  vs. William Gomis ,L/W
Brady Hiestand  vs. Batgerel Danaa ,W/L
Max Holloway  vs. Arnold Allen ,W/L
Edson Barboza  vs. Billy Quarantillo ,W/L
Dustin Jacoby  vs. Azamat Murzakanov ,L/W
Tanner Boser  vs. Ion Cutelaba ,L/W
Pedro Munhoz  vs. Chris Gutierrez ,W/L
Clay Guida  vs. Rafa Garcia ,L/W
Bill Algeo  vs. TJ Brown ,W/L
Brandon Royval  vs. Matheus Nicolau ,W/L
Zak Cummings  vs. Ed Herman ,W/L
Gillian Robertson  vs. Piera Rodriguez ,W/L
Lando Vannata  vs. Daniel Zellhuber ,L/W
Bruna Brasil  vs. Denise Gomes ,L/W
Aaron Phillips  vs. Gaston Bolanos ,L/W
Joselyne Edwards  vs. Lucie Pudilova ,W/L
Alex Pereira  vs. Israel Adesanya ,L/W
Gilbert Burns  vs. Jorge Masvidal ,W/L
Rob Font  vs. Adrian Yanez ,W/L
Kevin Holland  vs. Santiago Ponzinibbio ,W/L
Raul Rosas Jr.  vs. Christian Rodriguez ,L/W
Chris Curtis  vs. Kelvin Gastelum ,L/W
Michelle Waterson-Gomez  vs. Luana Pinheiro ,L/W
Gerald Meerschaert  vs. Joe Pyfer ,L/W
Cynthia Calvillo  vs. Loopy Godinez ,L/W
Ignacio Bahamondes  vs. Trey Ogden ,W/L
Shayilan Nuerdanbieke  vs. Steve Garcia ,L/W
Jaqueline Amorim  vs. Sam Hughes ,L/W
Marlon Vera  vs. Cory Sandhagen ,L/W
Holly Holm  vs. Yana Santos ,W/L
Nate Landwehr  vs. Austin Lingo ,W/L
Andrea Lee  vs. Maycee Barber ,L/W
Chidi Njokuani  vs. Albert Duraev ,L/W
Daniel Pineda  vs. Tucker Lutz ,W/L
Steven Peterson  vs. Lucas Alexander ,L/W
Trevin Giles  vs. Preston Parsons ,W/L
CJ Vergara  vs. Daniel Lacerda ,W/L
Victor Altamirano  vs. Vinicius Salvador ,W/L
Leon Edwards  vs. Kamaru Usman ,W/L
Justin Gaethje  vs. Rafael Fiziev ,W/L
Gunnar Nelson  vs. Bryan Barberena ,W/L
Jennifer Maia  vs. Casey O'Neill ,W/L
Marvin Vettori  vs. Roman Dolidze ,W/L
Jack Shore  vs. Makwan Amirkhani ,W/L
Chris Duncan  vs. Omar Morales ,W/L
Sam Patterson  vs. Yanal Ashmouz ,L/W
Muhammad Mokaev  vs. Jafel Filho ,W/L
Lerone Murphy  vs. Gabriel Santos ,W/L
Christian Duncan  vs. Dusko Todorovic ,W/L
Jake Hadley  vs. Malcolm Gordon ,W/L
Joanne Wood  vs. Luana Carolina ,W/L
Jai Herbert  vs. Ludovit Klein ,D/D
Juliana Miller  vs. Veronica Hardy ,L/W
Petr Yan  vs. Merab Dvalishvili ,L/W
Alexander Volkov  vs. Alexandr Romanov ,W/L
Nikita Krylov  vs. Ryan Spann ,W/L
Said Nurmagomedov  vs. Jonathan Martinez ,L/W
Mario Bautista  vs. Guido Cannetti ,W/L
Vitor Petrino  vs. Anton Turkalj ,W/L
Karl Williams  vs. Lukasz Brzeski ,W/L
Raphael Assuncao  vs. Davey Grant ,L/W
Sedriques Dumas  vs. Josh Fremd ,L/W
Victor Henry  vs. Tony Gravely ,W/L
Ariane Lipski  vs. JJ Aldrich ,W/L
Tyson Nam  vs. Bruno Silva ,L/W
Carlston Harris  vs. Jared Gooden ,W/L
Jon Jones  vs. Ciryl Gane ,W/L
Valentina Shevchenko  vs. Alexa Grasso ,L/W
Geoff Neal  vs. Shavkat Rakhmonov ,L/W
Mateusz Gamrot  vs. Jalin Turner ,W/L
Bo Nickal  vs. Jamie Pickett ,W/L
Cody Garbrandt  vs. Trevin Jones ,W/L
Derek Brunson  vs. Dricus Du Plessis ,L/W
Viviane Araujo  vs. Amanda Ribas ,L/W
Julian Marquez  vs. Marc-Andre Barriault ,L/W
Ian Garry  vs. Song Kenan ,W/L
Mana Martinez  vs. Cameron Saaiman ,L/W
Jessica Penne  vs. Tabatha Ricci ,L/W
Da'Mon Blackshear  vs. Farid Basharat ,L/W
Esteban Ribovics  vs. Loik Radzhabov ,L/W
Andre Muniz  vs. Brendan Allen ,L/W
Augusto Sakai  vs. Don'Tale Mayes ,W/L
Tatiana Suarez  vs. Montana De La Rosa ,W/L
Mike Malott  vs. Yohan Lainesse ,W/L
Erick Gonzalez  vs. Trevor Peek ,L/W
Jasmine Jasudavicius  vs. Gabriella Fernandes ,W/L
Jordan Leavitt  vs. Victor Martinez ,W/L
Ode Osbourne  vs. Charles Johnson ,W/L
Joe Solecki  vs. Carl Deaton ,W/L
Rafael Alves  vs. Nurullo Aliev ,L/W
Jessica Andrade  vs. Erin Blanchfield ,L/W
Jordan Wright  vs. Zac Pauga ,L/W
Josh Parisian  vs. Jamal Pogues ,L/W
William Knight  vs. Marcin Prachnio ,L/W
Jim Miller  vs. Alexander Hernandez ,L/W
Nazim Sadykhov  vs. Evan Elder ,W/L
Lina Lansberg  vs. Mayra Bueno Silva ,L/W
Jamall Emmers  vs. Khusein Askhabov ,W/L
Ovince Saint Preux  vs. Philipe Lins ,L/W
AJ Fletcher  vs. Themba Gorimbo ,W/L
Clayton Carpenter  vs. Juancamilo Ronderos ,W/L
Islam Makhachev  vs. Alexander Volkanovski ,W/L
Yair Rodriguez  vs. Josh Emmett ,W/L
